saved_logs/2020_01_01/autotvm/t4/bert-B1-float32.kernel.log
{"input": ["cuda -keys=cuda,gpu -max_num_threads=1024 -thread_warp_size=32", "dense_small_batch.cuda", [["TENSOR", [1, 768], "float32"], ["TENSOR", [768, 768], "float32"], null, "float32"], {}], "config": {"index": 10, "code_hash": null, "entity": [["tile_k", "sp", [-1, 48]]]}, "result": [[5.019791787918519e-06], 0, 1.466942548751831, 1609326547.64094], "version": 0.2, "tvm_version": "0.8.dev0"}
{"input": ["cuda -keys=cuda,gpu -max_num_threads=1024 -thread_warp_size=32", "dense_small_batch.cuda", [["TENSOR", [1, 768], "float32"], ["TENSOR", [768, 768], "float32"], null, "float32"], {}], "config": {"index": 15, "code_hash": null, "entity": [["tile_k", "sp", [-1, 256]]]}, "result": [[7.357880997025734e-06], 0, 1.6139061450958252, 1609326548.8197868], "version": 0.2, "tvm_version": "0.8.dev0"}
{"input": ["cuda -keys=cuda,gpu -max_num_threads=1024 -thread_warp_size=32", "dense_small_batch.cuda", [["TENSOR", [1, 768], "float32"], ["TENSOR", [768, 768], "float32"], null, "float32"], {}], "config": {"index": 17, "code_hash": null, "entity": [["tile_k", "sp", [-1, 768]]]}, "result": [[2.5996125708678584e-05], 0, 1.594949722290039, 1609326550.0565634], "version": 0.2, "tvm_version": "0.8.dev0"}
{"input": ["cuda -keys=cuda,gpu -max_num_threads=1024 -thread_warp_size=32", "dense_small_batch.cuda", [["TENSOR", [1, 768], "float32"], ["TENSOR", [768, 768], "float32"], null, "float32"], {}], "config": {"index": 16, "code_hash": null, "entity": [["tile_k", "sp", [-1, 384]]]}, "result": [[1.2287626253656498e-05], 0, 1.6071696281433105, 1609326551.2573485], "version": 0.2, "tvm_version": "0.8.dev0"}
{"input": ["cuda -keys=cuda,gpu -max_num_threads=1024 -thread_warp_size=32", "dense_small_batch.cuda", [["TENSOR", [1, 768], "float32"], ["TENSOR", [768, 768], "float32"], null, "float32"], {}], "config": {"index": 6, "code_hash": null, "entity": [["tile_k", "sp", [-1, 12]]]}, "result": [[6.93894597849715e-06], 0, 1.5993309020996094, 1609326552.4599822], "version": 0.2, "tvm_version": "0.8.dev0"}
{"input": ["cuda -keys=cuda,gpu -max_num_threads=1024 -thread_warp_size=32", "dense_small_batch.cuda", [["TENSOR", [1, 768], "float32"], ["TENSOR", [768, 768], "float32"], null, "float32"], {}], "config": {"index": 5, "code_hash": null, "entity": [["tile_k", "sp", [-1, 8]]]}, "result": [[8.331604532677442e-06], 0, 1.5931718349456787, 1609326553.6971123], "version": 0.2, "tvm_version": "0.8.dev0"}
{"input": ["cuda -keys=cuda,gpu -max_num_threads=1024 -thread_warp_size=32", "dense_small_batch.cuda", [["TENSOR", [1, 768], "float32"], ["TENSOR", [768, 768], "float32"], null, "float32"], {}], "config": {"index": 14, "code_hash": null, "entity": [["tile_k", "sp", [-1, 192]]]}, "result": [[6.3885372006477085e-06], 0, 1.5635817050933838, 1609326554.8650053], "version": 0.2, "tvm_version": "0.8.dev0"}
{"input": ["cuda -keys=cuda,gpu -max_num_threads=1024 -thread_warp_size=32", "dense_small_batch.cuda", [["TENSOR", [1, 768], "float32"], ["TENSOR", [768, 768], "float32"], null, "float32"], {}], "config": {"index": 1, "code_hash": null, "entity": [["tile_k", "sp", [-1, 2]]]}, "result": [[2.4318505969534787e-05], 0, 1.6283133029937744, 1609326556.0782921], "version": 0.2, "tvm_version": "0.8.dev0"}
{"input": ["cuda -keys=cuda,gpu -max_num_threads=1024 -thread_warp_size=32", "dense_small_batch.cuda", [["TENSOR", [1, 768], "float32"], ["TENSOR", [768, 768], "float32"], null, "float32"], {}], "config": {"index": 12, "code_hash": null, "entity": [["tile_k", "sp", [-1, 96]]]}, "result": [[4.903168171582238e-06], 0, 1.6025583744049072, 1609326557.2650673], "version": 0.2, "tvm_version": "0.8.dev0"}
{"input": ["cuda -keys=cuda,gpu -max_num_threads=1024 -thread_warp_size=32", "dense_small_batch.cuda", [["TENSOR", [1, 768], "float32"], ["TENSOR", [768, 768], "float32"], null, "float32"], {}], "config": {"index": 9, "code_hash": null, "entity": [["tile_k", "sp", [-1, 32]]]}, "result": [[4.000945708517488e-06], 0, 1.5558457374572754, 1609326558.4102623], "version": 0.2, "tvm_version": "0.8.dev0"}
{"input": ["cuda -keys=cuda,gpu -max_num_threads=1024 -thread_warp_size=32", "dense_small_batch.cuda", [["TENSOR", [1, 768], "float32"], ["TENSOR", [768, 768], "float32"], null, "float32"], {}], "config": {"index": 11, "code_hash": null, "entity": [["tile_k", "sp", [-1, 64]]]}, "result": [[4.576829242436598e-06], 0, 1.5841667652130127, 1609326559.5654604], "version": 0.2, "tvm_version": "0.8.dev0"}
{"input": ["cuda -keys=cuda,gpu -max_num_threads=1024 -thread_warp_size=32", "dense_small_batch.cuda", [["TENSOR", [1, 768], "float32"], ["TENSOR", [768, 768], "float32"], null, "float32"], {}], "config": {"index": 13, "code_hash": null, "entity": [["tile_k", "sp", [-1, 128]]]}, "result": [[5.155590585697236e-06], 0, 1.5822548866271973, 1609326560.7600977], "version": 0.2, "tvm_version": "0.8.dev0"}
{"input": ["cuda -keys=cuda,gpu -max_num_threads=1024 -thread_warp_size=32", "dense_small_batch.cuda", [["TENSOR", [1, 768], "float32"], ["TENSOR", [768, 768], "float32"], null, "float32"], {}], "config": {"index": 4, "code_hash": null, "entity": [["tile_k", "sp", [-1, 6]]]}, "result": [[1.0308582862765228e-05], 0, 1.6248655319213867, 1609326561.9859471], "version": 0.2, "tvm_version": "0.8.dev0"}
{"input": ["cuda -keys=cuda,gpu -max_num_threads=1024 -thread_warp_size=32", "dense_small_batch.cuda", [["TENSOR", [1, 768], "float32"], ["TENSOR", [768, 768], "float32"], null, "float32"], {}], "config": {"index": 8, "code_hash": null, "entity": [["tile_k", "sp", [-1, 24]]]}, "result": [[5.147224776931202e-06], 0, 1.533371925354004, 1609326563.1626961], "version": 0.2, "tvm_version": "0.8.dev0"}
{"input": ["cuda -keys=cuda,gpu -max_num_threads=1024 -thread_warp_size=32", "dense_small_batch.cuda", [["TENSOR", [1, 768], "float32"], ["TENSOR", [768, 768], "float32"], null, "float32"], {}], "config": {"index": 2, "code_hash": null, "entity": [["tile_k", "sp", [-1, 3]]]}, "result": [[1.7446954368718363e-05], 0, 1.6052038669586182, 1609326564.4169612], "version": 0.2, "tvm_version": "0.8.dev0"}
{"input": ["cuda -keys=cuda,gpu -max_num_threads=1024 -thread_warp_size=32", "dense_small_batch.cuda", [["TENSOR", [1, 768], "float32"], ["TENSOR", [768, 768], "float32"], null, "float32"], {}], "config": {"index": 7, "code_hash": null, "entity": [["tile_k", "sp", [-1, 16]]]}, "result": [[5.8589315617313684e-06], 0, 1.5636262893676758, 1609326565.6016905], "version": 0.2, "tvm_version": "0.8.dev0"}
{"input": ["cuda -keys=cuda,gpu -max_num_threads=1024 -thread_warp_size=32", "dense_small_batch.cuda", [["TENSOR", [1, 768], "float32"], ["TENSOR", [768, 768], "float32"], null, "float32"], {}], "config": {"index": 0, "code_hash": null, "entity": [["tile_k", "sp", [-1, 1]]]}, "result": [[4.7690994790623126e-05], 0, 1.3826875686645508, 1609326567.212893], "version": 0.2, "tvm_version": "0.8.dev0"}
{"input": ["cuda -keys=cuda,gpu -max_num_threads=1024 -thread_warp_size=32", "dense_small_batch.cuda", [["TENSOR", [1, 768], "float32"], ["TENSOR", [768, 768], "float32"], null, "float32"], {}], "config": {"index": 3, "code_hash": null, "entity": [["tile_k", "sp", [-1, 4]]]}, "result": [[1.3575951803848959e-05], 0, 1.4368152618408203, 1609326568.4584491], "version": 0.2, "tvm_version": "0.8.dev0"}
{"input": ["cuda -keys=cuda,gpu -max_num_threads=1024 -thread_warp_size=32", "dense_large_batch.cuda", [["TENSOR", [128, 768], "float32"], ["TENSOR", [2304, 768], "float32"], null, "float32"], {}], "config": {"index": 17625824, "code_hash": null, "entity": [["tile_x", "sp", [-1, 1, 2, 16]], ["tile_y", "sp", [-1, 6, 2, 1]], ["tile_k", "sp", [-1, 8, 16]]]}, "result": [[0.01117409595], 0, 8.710961103439331, 1609326592.577326], "version": 0.2, "tvm_version": "0.8.dev0"}
{"input": ["cuda -keys=cuda,gpu -max_num_threads=1024 -thread_warp_size=32", "dense_large_batch.cuda", [["TENSOR", [128, 768], "float32"], ["TENSOR", [2304, 768], "float32"], null, "float32"], {}], "config": {"index": 13142556, "code_hash": null, "entity": [["tile_x", "sp", [-1, 1, 1, 2]], ["tile_y", "sp", [-1, 1, 1, 4]], ["tile_k", "sp", [-1, 2, 8]]]}, "result": [[0.0120050498], 0, 1.8326680660247803, 1609326611.6300921], "version": 0.2, "tvm_version": "0.8.dev0"}
{"input": ["cuda -keys=cuda,gpu -max_num_threads=1024 -thread_warp_size=32", "dense_large_batch.cuda", [["TENSOR", [128, 768], "float32"], ["TENSOR", [2304, 768], "float32"], null, "float32"], {}], "config": {"index": 17696556, "code_hash": null, "entity": [["tile_x", "sp", [-1, 1, 1, 2]], ["tile_y", "sp", [-1, 1, 1, 4]], ["tile_k", "sp", [-1, 8, 16]]]}, "result": [[0.0118404049], 0, 2.326500654220581, 1609326613.0291328], "version": 0.2, "tvm_version": "0.8.dev0"}
{"input": ["cuda -keys=cuda,gpu -max_num_threads=1024 -thread_warp_size=32", "dense_large_batch.cuda", [["TENSOR", [128, 768], "float32"], ["TENSOR", [2304, 768], "float32"], null, "float32"], {}], "config": {"index": 10296085, "code_hash": null, "entity": [["tile_x", "sp", [-1, 1, 1, 8]], ["tile_y", "sp", [-1, 1, 1, 1]], ["tile_k", "sp", [-1, 32, 4]]]}, "result": [[0.019598503], 0, 5.035583257675171, 1609326754.4238446], "version": 0.2, "tvm_version": "0.8.dev0"}
{"input": ["cuda -keys=cuda,gpu -max_num_threads=1024 -thread_warp_size=32", "dense_large_batch.cuda", [["TENSOR", [128, 768], "float32"], ["TENSOR", [2304, 768], "float32"], null, "float32"], {}], "config": {"index": 10692085, "code_hash": null, "entity": [["tile_x", "sp", [-1, 1, 1, 8]], ["tile_y", "sp", [-1, 1, 1, 1]], ["tile_k", "sp", [-1, 64, 4]]]}, "result": [[0.0242474205], 0, 7.927588939666748, 1609326756.9664216], "version": 0.2, "tvm_version": "0.8.dev0"}
{"input": ["cuda -keys=cuda,gpu -max_num_threads=1024 -thread_warp_size=32", "dense_large_batch.cuda", [["TENSOR", [128, 768], "float32"], ["TENSOR", [2304, 768], "float32"], null, "float32"], {}], "config": {"index": 17654464, "code_hash": null, "entity": [["tile_x", "sp", [-1, 1, 1, 4]], ["tile_y", "sp", [-1, 1, 1, 2]], ["tile_k", "sp", [-1, 8, 16]]]}, "result": [[0.01237409915], 0, 3.073810338973999, 1609326758.4308949], "version": 0.2, "tvm_version": "0.8.dev0"}
{"input": ["cuda -keys=cuda,gpu -max_num_threads=1024 -thread_warp_size=32", "dense_large_batch.cuda", [["TENSOR", [128, 768], "float32"], ["TENSOR", [2304, 768], "float32"], null, "float32"], {}], "config": {"index": 17820085, "code_hash": null, "entity": [["tile_x", "sp", [-1, 1, 1, 8]], ["tile_y", "sp", [-1, 1, 1, 1]], ["tile_k", "sp", [-1, 12, 16]]]}, "result": [[0.01617759135], 0, 5.39076828956604, 1609326760.3993378], "version": 0.2, "tvm_version": "0.8.dev0"}
{"input": ["cuda -keys=cuda,gpu -max_num_threads=1024 -thread_warp_size=32", "dense_large_batch.cuda", [["TENSOR", [128, 768], "float32"], ["TENSOR", [2304, 768], "float32"], null, "float32"], {}], "config": {"index": 12276085, "code_hash": null, "entity": [["tile_x", "sp", [-1, 1, 1, 8]], ["tile_y", "sp", [-1, 1, 1, 1]], ["tile_k", "sp", [-1, 32, 6]]]}, "result": [[0.0161769676], 0, 4.764692783355713, 1609326761.7363014], "version": 0.2, "tvm_version": "0.8.dev0"}
{"input": ["cuda -keys=cuda,gpu -max_num_threads=1024 -thread_warp_size=32", "dense_large_batch.cuda", [["TENSOR", [128, 768], "float32"], ["TENSOR", [2304, 768], "float32"], null, "float32"], {}], "config": {"index": 14288464, "code_hash": null, "entity": [["tile_x", "sp", [-1, 1, 1, 4]], ["tile_y", "sp", [-1, 1, 1, 2]], ["tile_k", "sp", [-1, 16, 8]]]}, "result": [[0.012382908500000001], 0, 3.1632463932037354, 1609326762.8399875], "version": 0.2, "tvm_version": "0.8.dev0"}
{"input": ["cuda -keys=cuda,gpu -max_num_threads=1024 -thread_warp_size=32", "dense_large_batch.cuda", [["TENSOR", [128, 768], "float32"], ["TENSOR", [2304, 768], "float32"], null, "float32"], {}], "config": {"index": 19206085, "code_hash": null, "entity": [["tile_x", "sp", [-1, 1, 1, 8]], ["tile_y", "sp", [-1, 1, 1, 1]], ["tile_k", "sp", [-1, 8, 24]]]}, "result": [[0.01627305945], 0, 4.763075113296509, 1609326764.1901436], "version": 0.2, "tvm_version": "0.8.dev0"}
{"input": ["cuda -keys=cuda,gpu -max_num_threads=1024 -thread_warp_size=32", "dense_large_batch.cuda", [["TENSOR", [128, 768], "float32"], ["TENSOR", [2304, 768], "float32"], null, "float32"], {}], "config": {"index": 14652085, "code_hash": null, "entity": [["tile_x", "sp", [-1, 1, 1, 8]], ["tile_y", "sp", [-1, 1, 1, 1]], ["tile_k", "sp", [-1, 32, 8]]]}, "result": [[0.024248853549999998], 0, 6.678725481033325, 1609326766.0257115], "version": 0.2, "tvm_version": "0.8.dev0"}
{"input": ["cuda -keys=cuda,gpu -max_num_threads=1024 -thread_warp_size=32", "dense_large_batch.cuda", [["TENSOR", [128, 768], "float32"], ["TENSOR", [2304, 768], "float32"], null, "float32"], {}], "config": {"index": 20394085, "code_hash": null, "entity": [["tile_x", "sp", [-1, 1, 1, 8]], ["tile_y", "sp", [-1, 1, 1, 1]], ["tile_k", "sp", [-1, 4, 32]]]}, "result": [[0.0195264837], 0, 3.1624207496643066, 1609326767.5844452], "version": 0.2, "tvm_version": "0.8.dev0"}
{"input": ["cuda -keys=cuda,gpu -max_num_threads=1024 -thread_warp_size=32", "dense_large_batch.cuda", [["TENSOR", [128, 768], "float32"], ["TENSOR", [2304, 768], "float32"], null, "float32"], {}], "config": {"index": 20592085, "code_hash": null, "entity": [["tile_x", "sp", [-1, 1, 1, 8]], ["tile_y", "sp", [-1, 1, 1, 1]], ["tile_k", "sp", [-1, 6, 32]]]}, "result": [[0.01617419915], 0, 4.719821929931641, 1609326768.9322495], "version": 0.2, "tvm_version": "0.8.dev0"}
{"input": ["cuda -keys=cuda,gpu -max_num_threads=1024 -thread_warp_size=32", "dense_large_batch.cuda", [["TENSOR", [128, 768], "float32"], ["TENSOR", [2304, 768], "float32"], null, "float32"], {}], "config": {"index": 10692036, "code_hash": null, "entity": [["tile_x", "sp", [-1, 1, 1, 2]], ["tile_y", "sp", [-1, 1, 1, 1]], ["tile_k", "sp", [-1, 64, 4]]]}, "result": [[0.020571633750000002], 0, 4.484756231307983, 1609326770.8314102], "version": 0.2, "tvm_version": "0.8.dev0"}
{"input": ["cuda -keys=cuda,gpu -max_num_threads=1024 -thread_warp_size=32", "dense_large_batch.cuda", [["TENSOR", [128, 768], "float32"], ["TENSOR", [2304, 768], "float32"], null, "float32"], {}], "config": {"index": 12078184, "code_hash": null, "entity": [["tile_x", "sp", [-1, 1, 1, 4]], ["tile_y", "sp", [-1, 2, 1, 1]], ["tile_k", "sp", [-1, 16, 6]]]}, "result": [[0.00946697655], 0, 2.523902654647827, 1609326771.9850695], "version": 0.2, "tvm_version": "0.8.dev0"}
{"input": ["cuda -keys=cuda,gpu -max_num_threads=1024 -thread_warp_size=32", "dense_large_batch.cuda", [["TENSOR", [128, 768], "float32"], ["TENSOR", [2304, 768], "float32"], null, "float32"], {}], "config": {"index": 14652036, "code_hash": null, "entity": [["tile_x", "sp", [-1, 1, 1, 2]], ["tile_y", "sp", [-1, 1, 1, 1]], ["tile_k", "sp", [-1, 32, 8]]]}, "result": [[0.0205704487], 0, 3.496854782104492, 1609326773.6041977], "version": 0.2, "tvm_version": "0.8.dev0"}
{"input": ["cuda -keys=cuda,gpu -max_num_threads=1024 -thread_warp_size=32", "dense_large_batch.cuda", [["TENSOR", [128, 768], "float32"], ["TENSOR", [2304, 768], "float32"], null, "float32"], {}], "config": {"index": 14058037, "code_hash": null, "entity": [["tile_x", "sp", [-1, 2, 1, 2]], ["tile_y", "sp", [-1, 1, 1, 1]], ["tile_k", "sp", [-1, 12, 8]]]}, "result": [[0.015428175799999999], 0, 2.4220101833343506, 1609326778.7708573], "version": 0.2, "tvm_version": "0.8.dev0"}
{"input": ["cuda -keys=cuda,gpu -max_num_threads=1024 -thread_warp_size=32", "dense_large_batch.cuda", [["TENSOR", [128, 768], "float32"], ["TENSOR", [2304, 768], "float32"], null, "float32"], {}], "config": {"index": 14256064, "code_hash": null, "entity": [["tile_x", "sp", [-1, 1, 1, 4]], ["tile_y", "sp", [-1, 1, 1, 1]], ["tile_k", "sp", [-1, 16, 8]]]}, "result": [[0.0214196231], 0, 3.001061201095581, 1609326780.6626015], "version": 0.2, "tvm_version": "0.8.dev0"}
{"input": ["cuda -keys=cuda,gpu -max_num_threads=1024 -thread_warp_size=32", "dense_large_batch.cuda", [["TENSOR", [128, 768], "float32"], ["TENSOR", [2304, 768], "float32"], null, "float32"], {}], "config": {"index": 13860064, "code_hash": null, "entity": [["tile_x", "sp", [-1, 1, 1, 4]], ["tile_y", "sp", [-1, 1, 1, 1]], ["tile_k", "sp", [-1, 8, 8]]]}, "result": [[0.02190773685], 0, 2.439288377761841, 1609326782.4856596], "version": 0.2, "tvm_version": "0.8.dev0"}
{"input": ["cuda -keys=cuda,gpu -max_num_threads=1024 -thread_warp_size=32", "dense_large_batch.cuda", [["TENSOR", [128, 768], "float32"], ["TENSOR", [2304, 768], "float32"], null, "float32"], {}], "config": {"index": 12078085, "code_hash": null, "entity": [["tile_x", "sp", [-1, 1, 1, 8]], ["tile_y", "sp", [-1, 1, 1, 1]], ["tile_k", "sp", [-1, 16, 6]]]}, "result": [[0.0140338065], 0, 2.799877166748047, 1609326783.9801714], "version": 0.2, "tvm_version": "0.8.dev0"}
{"input": ["cuda -keys=cuda,gpu -max_num_threads=1024 -thread_warp_size=32", "dense_large_batch.cuda", [["TENSOR", [128, 768], "float32"], ["TENSOR", [2304, 768], "float32"], null, "float32"], {}], "config": {"index": 12078036, "code_hash": null, "entity": [["tile_x", "sp", [-1, 1, 1, 2]], ["tile_y", "sp", [-1, 1, 1, 1]], ["tile_k", "sp", [-1, 16, 6]]]}, "result": [[0.01868391465], 0, 2.2348201274871826, 1609326785.6629415], "version": 0.2, "tvm_version": "0.8.dev0"}
{"input": ["cuda -keys=cuda,gpu -max_num_threads=1024 -thread_warp_size=32", "dense_large_batch.cuda", [["TENSOR", [128, 768], "float32"], ["TENSOR", [2304, 768], "float32"], null, "float32"], {}], "config": {"index": 15840065, "code_hash": null, "entity": [["tile_x", "sp", [-1, 2, 1, 4]], ["tile_y", "sp", [-1, 1, 1, 1]], ["tile_k", "sp", [-1, 8, 12]]]}, "result": [[0.01403275695], 0, 2.720144748687744, 1609326787.284597], "version": 0.2, "tvm_version": "0.8.dev0"}
{"input": ["cuda -keys=cuda,gpu -max_num_threads=1024 -thread_warp_size=32", "dense_large_batch.cuda", [["TENSOR", [128, 768], "float32"], ["TENSOR", [2304, 768], "float32"], null, "float32"], {}], "config": {"index": 15840085, "code_hash": null, "entity": [["tile_x", "sp", [-1, 1, 1, 8]], ["tile_y", "sp", [-1, 1, 1, 1]], ["tile_k", "sp", [-1, 8, 12]]]}, "result": [[0.014033068749999999], 0, 2.5991039276123047, 1609326788.6277568], "version": 0.2, "tvm_version": "0.8.dev0"}
{"input": ["cuda -keys=cuda,gpu -max_num_threads=1024 -thread_warp_size=32", "dense_large_batch.cuda", [["TENSOR", [128, 768], "float32"], ["TENSOR", [2304, 768], "float32"], null, "float32"], {}], "config": {"index": 10098184, "code_hash": null, "entity": [["tile_x", "sp", [-1, 1, 1, 4]], ["tile_y", "sp", [-1, 2, 1, 1]], ["tile_k", "sp", [-1, 24, 4]]]}, "result": [[0.009539851050000001], 0, 2.041790008544922, 1609326789.5654702], "version": 0.2, "tvm_version": "0.8.dev0"}
{"input": ["cuda -keys=cuda,gpu -max_num_threads=1024 -thread_warp_size=32", "dense_large_batch.cuda", [["TENSOR", [128, 768], "float32"], ["TENSOR", [2304, 768], "float32"], null, "float32"], {}], "config": {"index": 14454065, "code_hash": null, "entity": [["tile_x", "sp", [-1, 2, 1, 4]], ["tile_y", "sp", [-1, 1, 1, 1]], ["tile_k", "sp", [-1, 24, 8]]]}, "result": [[0.0162501383], 0, 4.859507083892822, 1609326791.5108528], "version": 0.2, "tvm_version": "0.8.dev0"}
{"input": ["cuda -keys=cuda,gpu -max_num_threads=1024 -thread_warp_size=32", "dense_large_batch.cuda", [["TENSOR", [128, 768], "float32"], ["TENSOR", [2304, 768], "float32"], null, "float32"], {}], "config": {"index": 10098085, "code_hash": null, "entity": [["tile_x", "sp", [-1, 1, 1, 8]], ["tile_y", "sp", [-1, 1, 1, 1]], ["tile_k", "sp", [-1, 24, 4]]]}, "result": [[0.0140313876], 0, 2.7129967212677, 1609326792.715661], "version": 0.2, "tvm_version": "0.8.dev0"}
{"input": ["cuda -keys=cuda,gpu -max_num_threads=1024 -thread_warp_size=32", "dense_large_batch.cuda", [["TENSOR", [128, 768], "float32"], ["TENSOR", [2304, 768], "float32"], null, "float32"], {}], "config": {"index": 10296184, "code_hash": null, "entity": [["tile_x", "sp", [-1, 1, 1, 4]], ["tile_y", "sp", [-1, 2, 1, 1]], ["tile_k", "sp", [-1, 32, 4]]]}, "result": [[0.012635953850000001], 0, 2.953113555908203, 1609326794.1489353], "version": 0.2, "tvm_version": "0.8.dev0"}
{"input": ["cuda -keys=cuda,gpu -max_num_threads=1024 -thread_warp_size=32", "dense_large_batch.cuda", [["TENSOR", [128, 768], "float32"], ["TENSOR", [2304, 768], "float32"], null, "float32"], {}], "config": {"index": 16038184, "code_hash": null, "entity": [["tile_x", "sp", [-1, 1, 1, 4]], ["tile_y", "sp", [-1, 2, 1, 1]], ["tile_k", "sp", [-1, 16, 12]]]}, "result": [[0.0110797614], 0, 3.3367557525634766, 1609326806.2630215], "version": 0.2, "tvm_version": "0.8.dev0"}
{"input": ["cuda -keys=cuda,gpu -max_num_threads=1024 -thread_warp_size=32", "dense_large_batch.cuda", [["TENSOR", [128, 768], "float32"], ["TENSOR", [2304, 768], "float32"], null, "float32"], {}], "config": {"index": 14090464, "code_hash": null, "entity": [["tile_x", "sp", [-1, 1, 1, 4]], ["tile_y", "sp", [-1, 1, 1, 2]], ["tile_k", "sp", [-1, 12, 8]]]}, "result": [[0.0094753716], 0, 2.5467212200164795, 1609326807.4228938], "version": 0.2, "tvm_version": "0.8.dev0"}
{"input": ["cuda -keys=cuda,gpu -max_num_threads=1024 -thread_warp_size=32", "dense_large_batch.cuda", [["TENSOR", [128, 768], "float32"], ["TENSOR", [2304, 768], "float32"], null, "float32"], {}], "config": {"index": 17622065, "code_hash": null, "entity": [["tile_x", "sp", [-1, 2, 1, 4]], ["tile_y", "sp", [-1, 1, 1, 1]], ["tile_k", "sp", [-1, 8, 16]]]}, "result": [[0.019713676399999998], 0, 3.584536552429199, 1609326809.4415479], "version": 0.2, "tvm_version": "0.8.dev0"}
{"input": ["cuda -keys=cuda,gpu -max_num_threads=1024 -thread_warp_size=32", "dense_large_batch.cuda", [["TENSOR", [128, 768], "float32"], ["TENSOR", [2304, 768], "float32"], null, "float32"], {}], "config": {"index": 14256037, "code_hash": null, "entity": [["tile_x", "sp", [-1, 2, 1, 2]], ["tile_y", "sp", [-1, 1, 1, 1]], ["tile_k", "sp", [-1, 16, 8]]]}, "result": [[0.02152029045], 0, 2.8939273357391357, 1609326811.3356616], "version": 0.2, "tvm_version": "0.8.dev0"}
{"input": ["cuda -keys=cuda,gpu -max_num_threads=1024 -thread_warp_size=32", "dense_large_batch.cuda", [["TENSOR", [128, 768], "float32"], ["TENSOR", [2304, 768], "float32"], null, "float32"], {}], "config": {"index": 17622184, "code_hash": null, "entity": [["tile_x", "sp", [-1, 1, 1, 4]], ["tile_y", "sp", [-1, 2, 1, 1]], ["tile_k", "sp", [-1, 8, 16]]]}, "result": [[0.01263317425], 0, 2.6080849170684814, 1609326812.522661], "version": 0.2, "tvm_version": "0.8.dev0"}
{"input": ["cuda -keys=cuda,gpu -max_num_threads=1024 -thread_warp_size=32", "dense_large_batch.cuda", [["TENSOR", [128, 768], "float32"], ["TENSOR", [2304, 768], "float32"], null, "float32"], {}], "config": {"index": 14454184, "code_hash": null, "entity": [["tile_x", "sp", [-1, 1, 1, 4]], ["tile_y", "sp", [-1, 2, 1, 1]], ["tile_k", "sp", [-1, 24, 8]]]}, "result": [[0.010957602600000001], 0, 3.1086790561676025, 1609326813.5521095], "version": 0.2, "tvm_version": "0.8.dev0"}
{"input": ["cuda -keys=cuda,gpu -max_num_threads=1024 -thread_warp_size=32", "dense_large_batch.cuda", [["TENSOR", [128, 768], "float32"], ["TENSOR", [2304, 768], "float32"], null, "float32"], {}], "config": {"index": 14058184, "code_hash": null, "entity": [["tile_x", "sp", [-1, 1, 1, 4]], ["tile_y", "sp", [-1, 2, 1, 1]], ["tile_k", "sp", [-1, 12, 8]]]}, "result": [[0.0095668844], 0, 1.8373558521270752, 1609326814.4943266], "version": 0.2, "tvm_version": "0.8.dev0"}
{"input": ["cuda -keys=cuda,gpu -max_num_threads=1024 -thread_warp_size=32", "dense_large_batch.cuda", [["TENSOR", [128, 768], "float32"], ["TENSOR", [2304, 768], "float32"], null, "float32"], {}], "config": {"index": 17820184, "code_hash": null, "entity": [["tile_x", "sp", [-1, 1, 1, 4]], ["tile_y", "sp", [-1, 2, 1, 1]], ["tile_k", "sp", [-1, 12, 16]]]}, "result": [[0.01096276405], 0, 2.9761428833007812, 1609326815.5053592], "version": 0.2, "tvm_version": "0.8.dev0"}
{"input": ["cuda -keys=cuda,gpu -max_num_threads=1024 -thread_warp_size=32", "dense_large_batch.cuda", [["TENSOR", [128, 768], "float32"], ["TENSOR", [2304, 768], "float32"], null, "float32"], {}], "config": {"index": 16038065, "code_hash": null, "entity": [["tile_x", "sp", [-1, 2, 1, 4]], ["tile_y", "sp", [-1, 1, 1, 1]], ["tile_k", "sp", [-1, 16, 12]]]}, "result": [[0.016247318099999998], 0, 4.409285068511963, 1609326816.8516946], "version": 0.2, "tvm_version": "0.8.dev0"}
{"input": ["cuda -keys=cuda,gpu -max_num_threads=1024 -thread_warp_size=32", "dense_large_batch.cuda", [["TENSOR", [128, 768], "float32"], ["TENSOR", [2304, 768], "float32"], null, "float32"], {}], "config": {"index": 14850184, "code_hash": null, "entity": [["tile_x", "sp", [-1, 1, 1, 4]], ["tile_y", "sp", [-1, 2, 1, 1]], ["tile_k", "sp", [-1, 48, 8]]]}, "result": [[0.01906645455], 0, 7.094669342041016, 1609326819.7548609], "version": 0.2, "tvm_version": "0.8.dev0"}
{"input": ["cuda -keys=cuda,gpu -max_num_threads=1024 -thread_warp_size=32", "dense_large_batch.cuda", [["TENSOR", [128, 768], "float32"], ["TENSOR", [2304, 768], "float32"], null, "float32"], {}], "config": {"index": 16236184, "code_hash": null, "entity": [["tile_x", "sp", [-1, 1, 1, 4]], ["tile_y", "sp", [-1, 2, 1, 1]], ["tile_k", "sp", [-1, 32, 12]]]}, "result": [[0.0191008449], 0, 6.20123553276062, 1609326830.017117], "version": 0.2, "tvm_version": "0.8.dev0"}
{"input": ["cuda -keys=cuda,gpu -max_num_threads=1024 -thread_warp_size=32", "dense_large_batch.cuda", [["TENSOR", [128, 768], "float32"], ["TENSOR", [2304, 768], "float32"], null, "float32"], {}], "config": {"index": 14486464, "code_hash": null, "entity": [["tile_x", "sp", [-1, 1, 1, 4]], ["tile_y", "sp", [-1, 1, 1, 2]], ["tile_k", "sp", [-1, 24, 8]]]}, "result": [[0.01096052015], 0, 3.9675235748291016, 1609326831.4901164], "version": 0.2, "tvm_version": "0.8.dev0"}
{"input": ["cuda -keys=cuda,gpu -max_num_threads=1024 -thread_warp_size=32", "dense_large_batch.cuda", [["TENSOR", [128, 768], "float32"], ["TENSOR", [2304, 768], "float32"], null, "float32"], {}], "config": {"index": 14850085, "code_hash": null, "entity": [["tile_x", "sp", [-1, 1, 1, 8]], ["tile_y", "sp", [-1, 1, 1, 1]], ["tile_k", "sp", [-1, 48, 8]]]}, "result": [[0.03377799045], 0, 11.859527111053467, 1609326835.233382], "version": 0.2, "tvm_version": "0.8.dev0"}
{"input": ["cuda -keys=cuda,gpu -max_num_threads=1024 -thread_warp_size=32", "dense_large_batch.cuda", [["TENSOR", [128, 768], "float32"], ["TENSOR", [2304, 768], "float32"], null, "float32"], {}], "config": {"index": 12474184, "code_hash": null, "entity": [["tile_x", "sp", [-1, 1, 1, 4]], ["tile_y", "sp", [-1, 2, 1, 1]], ["tile_k", "sp", [-1, 64, 6]]]}, "result": [[0.0190983927], 0, 6.953761339187622, 1609326836.7565832], "version": 0.2, "tvm_version": "0.8.dev0"}
{"input": ["cuda -keys=cuda,gpu -max_num_threads=1024 -thread_warp_size=32", "dense_large_batch.cuda", [["TENSOR", [128, 768], "float32"], ["TENSOR", [2304, 768], "float32"], null, "float32"], {}], "config": {"index": 19404085, "code_hash": null, "entity": [["tile_x", "sp", [-1, 1, 1, 8]], ["tile_y", "sp", [-1, 1, 1, 1]], ["tile_k", "sp", [-1, 16, 24]]]}, "result": [[0.033776243649999996], 0, 9.858622550964355, 1609326839.187903], "version": 0.2, "tvm_version": "0.8.dev0"}
{"input": ["cuda -keys=cuda,gpu -max_num_threads=1024 -thread_warp_size=32", "dense_large_batch.cuda", [["TENSOR", [128, 768], "float32"], ["TENSOR", [2304, 768], "float32"], null, "float32"], {}], "config": {"index": 18216085, "code_hash": null, "entity": [["tile_x", "sp", [-1, 1, 1, 8]], ["tile_y", "sp", [-1, 1, 1, 1]], ["tile_k", "sp", [-1, 24, 16]]]}, "result": [[0.03376969765], 0, 9.622808456420898, 1609326841.6068075], "version": 0.2, "tvm_version": "0.8.dev0"}
{"input": ["cuda -keys=cuda,gpu -max_num_threads=1024 -thread_warp_size=32", "dense_large_batch.cuda", [["TENSOR", [128, 768], "float32"], ["TENSOR", [2304, 768], "float32"], null, "float32"], {}], "config": {"index": 14850065, "code_hash": null, "entity": [["tile_x", "sp", [-1, 2, 1, 4]], ["tile_y", "sp", [-1, 1, 1, 1]], ["tile_k", "sp", [-1, 48, 8]]]}, "result": [[0.0337266697], 0, 11.702653169631958, 1609326845.3995836], "version": 0.2, "tvm_version": "0.8.dev0"}
{"input": ["cuda -keys=cuda,gpu -max_num_threads=1024 -thread_warp_size=32", "dense_large_batch.cuda", [["TENSOR", [128, 768], "float32"], ["TENSOR", [2304, 768], "float32"], null, "float32"], {}], "config": {"index": 18216065, "code_hash": null, "entity": [["tile_x", "sp", [-1, 2, 1, 4]], ["tile_y", "sp", [-1, 1, 1, 1]], ["tile_k", "sp", [-1, 24, 16]]]}, "result": [[0.033726557350000005], 0, 9.804032564163208, 1609326847.8287985], "version": 0.2, "tvm_version": "0.8.dev0"}
{"input": ["cuda -keys=cuda,gpu -max_num_threads=1024 -thread_warp_size=32", "dense_large_batch.cuda", [["TENSOR", [128, 768], "float32"], ["TENSOR", [2304, 768], "float32"], null, "float32"], {}], "config": {"index": 18216184, "code_hash": null, "entity": [["tile_x", "sp", [-1, 1, 1, 4]], ["tile_y", "sp", [-1, 2, 1, 1]], ["tile_k", "sp", [-1, 24, 16]]]}, "result": [[0.0190628551], 0, 5.021892547607422, 1609326849.4098122], "version": 0.2, "tvm_version": "0.8.dev0"}
{"input": ["cuda -keys=cuda,gpu -max_num_threads=1024 -thread_warp_size=32", "dense_large_batch.cuda", [["TENSOR", [128, 768], "float32"], ["TENSOR", [2304, 768], "float32"], null, "float32"], {}], "config": {"index": 17226085, "code_hash": null, "entity": [["tile_x", "sp", [-1, 1, 1, 8]], ["tile_y", "sp", [-1, 1, 1, 1]], ["tile_k", "sp", [-1, 4, 16]]]}, "result": [[0.0199731199], 0, 2.532496929168701, 1609326851.1970127], "version": 0.2, "tvm_version": "0.8.dev0"}
{"input": ["cuda -keys=cuda,gpu -max_num_threads=1024 -thread_warp_size=32", "dense_large_batch.cuda", [["TENSOR", [128, 768], "float32"], ["TENSOR", [2304, 768], "float32"], null, "float32"], {}], "config": {"index": 17258464, "code_hash": null, "entity": [["tile_x", "sp", [-1, 1, 1, 4]], ["tile_y", "sp", [-1, 1, 1, 2]], ["tile_k", "sp", [-1, 4, 16]]]}, "result": [[0.012748528649999999], 0, 2.2806527614593506, 1609326852.5029962], "version": 0.2, "tvm_version": "0.8.dev0"}
{"input": ["cuda -keys=cuda,gpu -max_num_threads=1024 -thread_warp_size=32", "dense_large_batch.cuda", [["TENSOR", [128, 768], "float32"], ["TENSOR", [2304, 768], "float32"], null, "float32"], {}], "config": {"index": 15840184, "code_hash": null, "entity": [["tile_x", "sp", [-1, 1, 1, 4]], ["tile_y", "sp", [-1, 2, 1, 1]], ["tile_k", "sp", [-1, 8, 12]]]}, "result": [[0.0094692232], 0, 2.2784957885742188, 1609326977.8780434], "version": 0.2, "tvm_version": "0.8.dev0"}
{"input": ["cuda -keys=cuda,gpu -max_num_threads=1024 -thread_warp_size=32", "dense_large_batch.cuda", [["TENSOR", [128, 768], "float32"], ["TENSOR", [2304, 768], "float32"], null, "float32"], {}], "config": {"index": 15872464, "code_hash": null, "entity": [["tile_x", "sp", [-1, 1, 1, 4]], ["tile_y", "sp", [-1, 1, 1, 2]], ["tile_k", "sp", [-1, 8, 12]]]}, "result": [[0.009467817350000001], 0, 2.3668782711029053, 1609326978.825077], "version": 0.2, "tvm_version": "0.8.dev0"}
{"input": ["cuda -keys=cuda,gpu -max_num_threads=1024 -thread_warp_size=32", "dense_large_batch.cuda", [["TENSOR", [128, 768], "float32"], ["TENSOR", [2304, 768], "float32"], null, "float32"], {}], "config": {"index": 17424184, "code_hash": null, "entity": [["tile_x", "sp", [-1, 1, 1, 4]], ["tile_y", "sp", [-1, 2, 1, 1]], ["tile_k", "sp", [-1, 6, 16]]]}, "result": [[0.0094683487], 0, 2.1600594520568848, 1609326979.740353], "version": 0.2, "tvm_version": "0.8.dev0"}
{"input": ["cuda -keys=cuda,gpu -max_num_threads=1024 -thread_warp_size=32", "dense_large_batch.cuda", [["TENSOR", [128, 768], "float32"], ["TENSOR", [2304, 768], "float32"], null, "float32"], {}], "config": {"index": 17456464, "code_hash": null, "entity": [["tile_x", "sp", [-1, 1, 1, 4]], ["tile_y", "sp", [-1, 1, 1, 2]], ["tile_k", "sp", [-1, 6, 16]]]}, "result": [[0.0094668723], 0, 2.2082104682922363, 1609326980.6556885], "version": 0.2, "tvm_version": "0.8.dev0"}
{"input": ["cuda -keys=cuda,gpu -max_num_threads=1024 -thread_warp_size=32", "dense_large_batch.cuda", [["TENSOR", [128, 768], "float32"], ["TENSOR", [2304, 768], "float32"], null, "float32"], {}], "config": {"index": 15872436, "code_hash": null, "entity": [["tile_x", "sp", [-1, 1, 1, 2]], ["tile_y", "sp", [-1, 1, 1, 2]], ["tile_k", "sp", [-1, 8, 12]]]}, "result": [[0.0124176969], 0, 2.2306671142578125, 1609326981.904292], "version": 0.2, "tvm_version": "0.8.dev0"}
{"input": ["cuda -keys=cuda,gpu -max_num_threads=1024 -thread_warp_size=32", "dense_large_batch.cuda", [["TENSOR", [128, 768], "float32"], ["TENSOR", [2304, 768], "float32"], null, "float32"], {}], "config": {"index": 15840544, "code_hash": null, "entity": [["tile_x", "sp", [-1, 1, 1, 4]], ["tile_y", "sp", [-1, 6, 1, 1]], ["tile_k", "sp", [-1, 8, 12]]]}, "result": [[0.00565147321875], 0, 3.4448812007904053, 1609326983.4348726], "version": 0.2, "tvm_version": "0.8.dev0"}
{"input": ["cuda -keys=cuda,gpu -max_num_threads=1024 -thread_warp_size=32", "dense_large_batch.cuda", [["TENSOR", [128, 768], "float32"], ["TENSOR", [2304, 768], "float32"], null, "float32"], {}], "config": {"index": 15840304, "code_hash": null, "entity": [["tile_x", "sp", [-1, 1, 1, 4]], ["tile_y", "sp", [-1, 3, 1, 1]], ["tile_k", "sp", [-1, 8, 12]]]}, "result": [[0.007499455], 0, 2.890951156616211, 1609326984.952175], "version": 0.2, "tvm_version": "0.8.dev0"}
{"input": ["cuda -keys=cuda,gpu -max_num_threads=1024 -thread_warp_size=32", "dense_large_batch.cuda", [["TENSOR", [128, 768], "float32"], ["TENSOR", [2304, 768], "float32"], null, "float32"], {}], "config": {"index": 15840424, "code_hash": null, "entity": [["tile_x", "sp", [-1, 1, 1, 4]], ["tile_y", "sp", [-1, 4, 1, 1]], ["tile_k", "sp", [-1, 8, 12]]]}, "result": [[0.00681344846875], 0, 3.0575523376464844, 1609326986.4565656], "version": 0.2, "tvm_version": "0.8.dev0"}
{"input": ["cuda -keys=cuda,gpu -max_num_threads=1024 -thread_warp_size=32", "dense_large_batch.cuda", [["TENSOR", [128, 768], "float32"], ["TENSOR", [2304, 768], "float32"], null, "float32"], {}], "config": {"index": 12078205, "code_hash": null, "entity": [["tile_x", "sp", [-1, 1, 1, 8]], ["tile_y", "sp", [-1, 2, 1, 1]], ["tile_k", "sp", [-1, 16, 6]]]}, "result": [[0.00781180735], 0, 3.145880937576294, 1609326987.7413077], "version": 0.2, "tvm_version": "0.8.dev0"}
{"input": ["cuda -keys=cuda,gpu -max_num_threads=1024 -thread_warp_size=32", "dense_large_batch.cuda", [["TENSOR", [128, 768], "float32"], ["TENSOR", [2304, 768], "float32"], null, "float32"], {}], "config": {"index": 15840784, "code_hash": null, "entity": [["tile_x", "sp", [-1, 1, 1, 4]], ["tile_y", "sp", [-1, 9, 1, 1]], ["tile_k", "sp", [-1, 8, 12]]]}, "result": [[0.051096683], 0, 6.843171834945679, 1609326996.1342769], "version": 0.2, "tvm_version": "0.8.dev0"}
{"input": ["cuda -keys=cuda,gpu -max_num_threads=1024 -thread_warp_size=32", "dense_large_batch.cuda", [["TENSOR", [128, 768], "float32"], ["TENSOR", [2304, 768], "float32"], null, "float32"], {}], "config": {"index": 16070436, "code_hash": null, "entity": [["tile_x", "sp", [-1, 1, 1, 2]], ["tile_y", "sp", [-1, 1, 1, 2]], ["tile_k", "sp", [-1, 16, 12]]]}, "result": [[0.0126238633], 0, 3.078646183013916, 1609326997.564414], "version": 0.2, "tvm_version": "0.8.dev0"}
{"input": ["cuda -keys=cuda,gpu -max_num_threads=1024 -thread_warp_size=32", "dense_large_batch.cuda", [["TENSOR", [128, 768], "float32"], ["TENSOR", [2304, 768], "float32"], null, "float32"], {}], "config": {"index": 12078156, "code_hash": null, "entity": [["tile_x", "sp", [-1, 1, 1, 2]], ["tile_y", "sp", [-1, 2, 1, 1]], ["tile_k", "sp", [-1, 16, 6]]]}, "result": [[0.01245474035], 0, 2.334338426589966, 1609326998.8412957], "version": 0.2, "tvm_version": "0.8.dev0"}
{"input": ["cuda -keys=cuda,gpu -max_num_threads=1024 -thread_warp_size=32", "dense_large_batch.cuda", [["TENSOR", [128, 768], "float32"], ["TENSOR", [2304, 768], "float32"], null, "float32"], {}], "config": {"index": 15872400, "code_hash": null, "entity": [["tile_x", "sp", [-1, 1, 1, 1]], ["tile_y", "sp", [-1, 1, 1, 2]], ["tile_k", "sp", [-1, 8, 12]]]}, "result": [[0.01844182255], 0, 2.4541428089141846, 1609327000.4570694], "version": 0.2, "tvm_version": "0.8.dev0"}
{"input": ["cuda -keys=cuda,gpu -max_num_threads=1024 -thread_warp_size=32", "dense_large_batch.cuda", [["TENSOR", [128, 768], "float32"], ["TENSOR", [2304, 768], "float32"], null, "float32"], {}], "config": {"index": 15840120, "code_hash": null, "entity": [["tile_x", "sp", [-1, 1, 1, 1]], ["tile_y", "sp", [-1, 2, 1, 1]], ["tile_k", "sp", [-1, 8, 12]]]}, "result": [[0.0184248614], 0, 2.4705159664154053, 1609327002.0685813], "version": 0.2, "tvm_version": "0.8.dev0"}
{"input": ["cuda -keys=cuda,gpu -max_num_threads=1024 -thread_warp_size=32", "dense_large_batch.cuda", [["TENSOR", [128, 768], "float32"], ["TENSOR", [2304, 768], "float32"], null, "float32"], {}], "config": {"index": 14058205, "code_hash": null, "entity": [["tile_x", "sp", [-1, 1, 1, 8]], ["tile_y", "sp", [-1, 2, 1, 1]], ["tile_k", "sp", [-1, 12, 8]]]}, "result": [[0.0077790909000000005], 0, 2.6172964572906494, 1609327002.9128566], "version": 0.2, "tvm_version": "0.8.dev0"}
{"input": ["cuda -keys=cuda,gpu -max_num_threads=1024 -thread_warp_size=32", "dense_large_batch.cuda", [["TENSOR", [128, 768], "float32"], ["TENSOR", [2304, 768], "float32"], null, "float32"], {}], "config": {"index": 16268400, "code_hash": null, "entity": [["tile_x", "sp", [-1, 1, 1, 1]], ["tile_y", "sp", [-1, 1, 1, 2]], ["tile_k", "sp", [-1, 32, 12]]]}, "result": [[0.01862059215], 0, 4.398718357086182, 1609327009.1519175], "version": 0.2, "tvm_version": "0.8.dev0"}
{"input": ["cuda -keys=cuda,gpu -max_num_threads=1024 -thread_warp_size=32", "dense_large_batch.cuda", [["TENSOR", [128, 768], "float32"], ["TENSOR", [2304, 768], "float32"], null, "float32"], {}], "config": {"index": 15840396, "code_hash": null, "entity": [["tile_x", "sp", [-1, 1, 1, 2]], ["tile_y", "sp", [-1, 4, 1, 1]], ["tile_k", "sp", [-1, 8, 12]]]}, "result": [[0.00953735855], 0, 2.4539129734039307, 1609327010.3190124], "version": 0.2, "tvm_version": "0.8.dev0"}
{"input": ["cuda -keys=cuda,gpu -max_num_threads=1024 -thread_warp_size=32", "dense_large_batch.cuda", [["TENSOR", [128, 768], "float32"], ["TENSOR", [2304, 768], "float32"], null, "float32"], {}], "config": {"index": 16038396, "code_hash": null, "entity": [["tile_x", "sp", [-1, 1, 1, 2]], ["tile_y", "sp", [-1, 4, 1, 1]], ["tile_k", "sp", [-1, 16, 12]]]}, "result": [[0.01112352875], 0, 3.7737905979156494, 1609327011.8107893], "version": 0.2, "tvm_version": "0.8.dev0"}
{"input": ["cuda -keys=cuda,gpu -max_num_threads=1024 -thread_warp_size=32", "dense_large_batch.cuda", [["TENSOR", [128, 768], "float32"], ["TENSOR", [2304, 768], "float32"], null, "float32"], {}], "config": {"index": 15840276, "code_hash": null, "entity": [["tile_x", "sp", [-1, 1, 1, 2]], ["tile_y", "sp", [-1, 3, 1, 1]], ["tile_k", "sp", [-1, 8, 12]]]}, "result": [[0.01059682555], 0, 2.2623965740203857, 1609327013.005814], "version": 0.2, "tvm_version": "0.8.dev0"}
{"input": ["cuda -keys=cuda,gpu -max_num_threads=1024 -thread_warp_size=32", "dense_large_batch.cuda", [["TENSOR", [128, 768], "float32"], ["TENSOR", [2304, 768], "float32"], null, "float32"], {}], "config": {"index": 15840205, "code_hash": null, "entity": [["tile_x", "sp", [-1, 1, 1, 8]], ["tile_y", "sp", [-1, 2, 1, 1]], ["tile_k", "sp", [-1, 8, 12]]]}, "result": [[0.00787200695], 0, 2.7938408851623535, 1609327013.8569808], "version": 0.2, "tvm_version": "0.8.dev0"}
{"input": ["cuda -keys=cuda,gpu -max_num_threads=1024 -thread_warp_size=32", "dense_large_batch.cuda", [["TENSOR", [128, 768], "float32"], ["TENSOR", [2304, 768], "float32"], null, "float32"], {}], "config": {"index": 12276184, "code_hash": null, "entity": [["tile_x", "sp", [-1, 1, 1, 4]], ["tile_y", "sp", [-1, 2, 1, 1]], ["tile_k", "sp", [-1, 32, 6]]]}, "result": [[0.010961083600000001], 0, 3.502380132675171, 1609327014.874847], "version": 0.2, "tvm_version": "0.8.dev0"}
{"input": ["cuda -keys=cuda,gpu -max_num_threads=1024 -thread_warp_size=32", "dense_large_batch.cuda", [["TENSOR", [128, 768], "float32"], ["TENSOR", [2304, 768], "float32"], null, "float32"], {}], "config": {"index": 17852556, "code_hash": null, "entity": [["tile_x", "sp", [-1, 1, 1, 2]], ["tile_y", "sp", [-1, 2, 1, 2]], ["tile_k", "sp", [-1, 12, 16]]]}, "result": [[0.01113052115], 0, 3.7087316513061523, 1609327016.3731477], "version": 0.2, "tvm_version": "0.8.dev0"}
{"input": ["cuda -keys=cuda,gpu -max_num_threads=1024 -thread_warp_size=32", "dense_large_batch.cuda", [["TENSOR", [128, 768], "float32"], ["TENSOR", [2304, 768], "float32"], null, "float32"], {}], "config": {"index": 14058120, "code_hash": null, "entity": [["tile_x", "sp", [-1, 1, 1, 1]], ["tile_y", "sp", [-1, 2, 1, 1]], ["tile_k", "sp", [-1, 12, 8]]]}, "result": [[0.0186271044], 0, 2.3632442951202393, 1609327017.8900118], "version": 0.2, "tvm_version": "0.8.dev0"}
{"input": ["cuda -keys=cuda,gpu -max_num_threads=1024 -thread_warp_size=32", "dense_large_batch.cuda", [["TENSOR", [128, 768], "float32"], ["TENSOR", [2304, 768], "float32"], null, "float32"], {}], "config": {"index": 12110464, "code_hash": null, "entity": [["tile_x", "sp", [-1, 1, 1, 4]], ["tile_y", "sp", [-1, 1, 1, 2]], ["tile_k", "sp", [-1, 16, 6]]]}, "result": [[0.0095819561], 0, 2.6195945739746094, 1609327018.832009], "version": 0.2, "tvm_version": "0.8.dev0"}
{"input": ["cuda -keys=cuda,gpu -max_num_threads=1024 -thread_warp_size=32", "dense_large_batch.cuda", [["TENSOR", [128, 768], "float32"], ["TENSOR", [2304, 768], "float32"], null, "float32"], {}], "config": {"index": 19478520, "code_hash": null, "entity": [["tile_x", "sp", [-1, 1, 1, 1]], ["tile_y", "sp", [-1, 1, 1, 4]], ["tile_k", "sp", [-1, 16, 24]]]}, "result": [[0.02345880515], 0, 6.255708456039429, 1609327021.5880136], "version": 0.2, "tvm_version": "0.8.dev0"}
{"input": ["cuda -keys=cuda,gpu -max_num_threads=1024 -thread_warp_size=32", "dense_large_batch.cuda", [["TENSOR", [128, 768], "float32"], ["TENSOR", [2304, 768], "float32"], null, "float32"], {}], "config": {"index": 17654436, "code_hash": null, "entity": [["tile_x", "sp", [-1, 1, 1, 2]], ["tile_y", "sp", [-1, 1, 1, 2]], ["tile_k", "sp", [-1, 8, 16]]]}, "result": [[0.0139253718], 0, 2.63842511177063, 1609327022.9816358], "version": 0.2, "tvm_version": "0.8.dev0"}
{"input": ["cuda -keys=cuda,gpu -max_num_threads=1024 -thread_warp_size=32", "dense_large_batch.cuda", [["TENSOR", [128, 768], "float32"], ["TENSOR", [2304, 768], "float32"], null, "float32"], {}], "config": {"index": 17852436, "code_hash": null, "entity": [["tile_x", "sp", [-1, 1, 1, 2]], ["tile_y", "sp", [-1, 1, 1, 2]], ["tile_k", "sp", [-1, 12, 16]]]}, "result": [[0.0127511225], 0, 3.0078980922698975, 1609327024.1307552], "version": 0.2, "tvm_version": "0.8.dev0"}
{"input": ["cuda -keys=cuda,gpu -max_num_threads=1024 -thread_warp_size=32", "dense_large_batch.cuda", [["TENSOR", [128, 768], "float32"], ["TENSOR", [2304, 768], "float32"], null, "float32"], {}], "config": {"index": 16070464, "code_hash": null, "entity": [["tile_x", "sp", [-1, 1, 1, 4]], ["tile_y", "sp", [-1, 1, 1, 2]], ["tile_k", "sp", [-1, 16, 12]]]}, "result": [[0.0109564495], 0, 3.374596357345581, 1609327033.663866], "version": 0.2, "tvm_version": "0.8.dev0"}
{"input": ["cuda -keys=cuda,gpu -max_num_threads=1024 -thread_warp_size=32", "dense_large_batch.cuda", [["TENSOR", [128, 768], "float32"], ["TENSOR", [2304, 768], "float32"], null, "float32"], {}], "config": {"index": 17654556, "code_hash": null, "entity": [["tile_x", "sp", [-1, 1, 1, 2]], ["tile_y", "sp", [-1, 2, 1, 2]], ["tile_k", "sp", [-1, 8, 16]]]}, "result": [[0.0119408424], 0, 2.890423536300659, 1609327035.0721343], "version": 0.2, "tvm_version": "0.8.dev0"}
{"input": ["cuda -keys=cuda,gpu -max_num_threads=1024 -thread_warp_size=32", "dense_large_batch.cuda", [["TENSOR", [128, 768], "float32"], ["TENSOR", [2304, 768], "float32"], null, "float32"], {}], "config": {"index": 15840240, "code_hash": null, "entity": [["tile_x", "sp", [-1, 1, 1, 1]], ["tile_y", "sp", [-1, 3, 1, 1]], ["tile_k", "sp", [-1, 8, 12]]]}, "result": [[0.0168325873], 0, 2.438978910446167, 1609327040.7388191], "version": 0.2, "tvm_version": "0.8.dev0"}
{"input": ["cuda -keys=cuda,gpu -max_num_threads=1024 -thread_warp_size=32", "dense_large_batch.cuda", [["TENSOR", [128, 768], "float32"], ["TENSOR", [2304, 768], "float32"], null, "float32"], {}], "config": {"index": 17622424, "code_hash": null, "entity": [["tile_x", "sp", [-1, 1, 1, 4]], ["tile_y", "sp", [-1, 4, 1, 1]], ["tile_k", "sp", [-1, 8, 16]]]}, "result": [[0.009431956], 0, 3.1688473224639893, 1609327042.145055], "version": 0.2, "tvm_version": "0.8.dev0"}
{"input": ["cuda -keys=cuda,gpu -max_num_threads=1024 -thread_warp_size=32", "dense_large_batch.cuda", [["TENSOR", [128, 768], "float32"], ["TENSOR", [2304, 768], "float32"], null, "float32"], {}], "config": {"index": 17424424, "code_hash": null, "entity": [["tile_x", "sp", [-1, 1, 1, 4]], ["tile_y", "sp", [-1, 4, 1, 1]], ["tile_k", "sp", [-1, 6, 16]]]}, "result": [[0.00697260034375], 0, 2.7293763160705566, 1609327043.3218358], "version": 0.2, "tvm_version": "0.8.dev0"}
{"input": ["cuda -keys=cuda,gpu -max_num_threads=1024 -thread_warp_size=32", "dense_large_batch.cuda", [["TENSOR", [128, 768], "float32"], ["TENSOR", [2304, 768], "float32"], null, "float32"], {}], "config": {"index": 16038156, "code_hash": null, "entity": [["tile_x", "sp", [-1, 1, 1, 2]], ["tile_y", "sp", [-1, 2, 1, 1]], ["tile_k", "sp", [-1, 16, 12]]]}, "result": [[0.012903671799999999], 0, 3.045883893966675, 1609327044.7393138], "version": 0.2, "tvm_version": "0.8.dev0"}
{"input": ["cuda -keys=cuda,gpu -max_num_threads=1024 -thread_warp_size=32", "dense_large_batch.cuda", [["TENSOR", [128, 768], "float32"], ["TENSOR", [2304, 768], "float32"], null, "float32"], {}], "config": {"index": 14058156, "code_hash": null, "entity": [["tile_x", "sp", [-1, 1, 1, 2]], ["tile_y", "sp", [-1, 2, 1, 1]], ["tile_k", "sp", [-1, 12, 8]]]}, "result": [[0.01279067565], 0, 2.1273672580718994, 1609327045.8832908], "version": 0.2, "tvm_version": "0.8.dev0"}
{"input": ["cuda -keys=cuda,gpu -max_num_threads=1024 -thread_warp_size=32", "dense_large_batch.cuda", [["TENSOR", [128, 768], "float32"], ["TENSOR", [2304, 768], "float32"], null, "float32"], {}], "config": {"index": 14058424, "code_hash": null, "entity": [["tile_x", "sp", [-1, 1, 1, 4]], ["tile_y", "sp", [-1, 4, 1, 1]], ["tile_k", "sp", [-1, 12, 8]]]}, "result": [[0.006981016875], 0, 2.9540882110595703, 1609327047.0575798], "version": 0.2, "tvm_version": "0.8.dev0"}
{"input": ["cuda -keys=cuda,gpu -max_num_threads=1024 -thread_warp_size=32", "dense_large_batch.cuda", [["TENSOR", [128, 768], "float32"], ["TENSOR", [2304, 768], "float32"], null, "float32"], {}], "config": {"index": 15840156, "code_hash": null, "entity": [["tile_x", "sp", [-1, 1, 1, 2]], ["tile_y", "sp", [-1, 2, 1, 1]], ["tile_k", "sp", [-1, 8, 12]]]}, "result": [[0.01279359205], 0, 2.042588472366333, 1609327048.2044897], "version": 0.2, "tvm_version": "0.8.dev0"}
{"input": ["cuda -keys=cuda,gpu -max_num_threads=1024 -thread_warp_size=32", "dense_large_batch.cuda", [["TENSOR", [128, 768], "float32"], ["TENSOR", [2304, 768], "float32"], null, "float32"], {}], "config": {"index": 16268436, "code_hash": null, "entity": [["tile_x", "sp", [-1, 1, 1, 2]], ["tile_y", "sp", [-1, 1, 1, 2]], ["tile_k", "sp", [-1, 32, 12]]]}, "result": [[0.015354028950000001], 0, 5.514846563339233, 1609327050.259653], "version": 0.2, "tvm_version": "0.8.dev0"}
{"input": ["cuda -keys=cuda,gpu -max_num_threads=1024 -thread_warp_size=32", "dense_large_batch.cuda", [["TENSOR", [128, 768], "float32"], ["TENSOR", [2304, 768], "float32"], null, "float32"], {}], "config": {"index": 12078304, "code_hash": null, "entity": [["tile_x", "sp", [-1, 1, 1, 4]], ["tile_y", "sp", [-1, 3, 1, 1]], ["tile_k", "sp", [-1, 16, 6]]]}, "result": [[0.0076675374000000004], 0, 2.309678077697754, 1609327051.0902734], "version": 0.2, "tvm_version": "0.8.dev0"}
{"input": ["cuda -keys=cuda,gpu -max_num_threads=1024 -thread_warp_size=32", "dense_large_batch.cuda", [["TENSOR", [128, 768], "float32"], ["TENSOR", [2304, 768], "float32"], null, "float32"], {}], "config": {"index": 12078424, "code_hash": null, "entity": [["tile_x", "sp", [-1, 1, 1, 4]], ["tile_y", "sp", [-1, 4, 1, 1]], ["tile_k", "sp", [-1, 16, 6]]]}, "result": [[0.0069873993125], 0, 2.7831506729125977, 1609327052.2550933], "version": 0.2, "tvm_version": "0.8.dev0"}
{"input": ["cuda -keys=cuda,gpu -max_num_threads=1024 -thread_warp_size=32", "dense_large_batch.cuda", [["TENSOR", [128, 768], "float32"], ["TENSOR", [2304, 768], "float32"], null, "float32"], {}], "config": {"index": 15840516, "code_hash": null, "entity": [["tile_x", "sp", [-1, 1, 1, 2]], ["tile_y", "sp", [-1, 6, 1, 1]], ["tile_k", "sp", [-1, 8, 12]]]}, "result": [[0.0088103391], 0, 2.8721344470977783, 1609327053.4653563], "version": 0.2, "tvm_version": "0.8.dev0"}
{"input": ["cuda -keys=cuda,gpu -max_num_threads=1024 -thread_warp_size=32", "dense_large_batch.cuda", [["TENSOR", [128, 768], "float32"], ["TENSOR", [2304, 768], "float32"], null, "float32"], {}], "config": {"index": 15840636, "code_hash": null, "entity": [["tile_x", "sp", [-1, 1, 1, 2]], ["tile_y", "sp", [-1, 8, 1, 1]], ["tile_k", "sp", [-1, 8, 12]]]}, "result": [[0.0078411721], 0, 3.088937282562256, 1609327054.7081575], "version": 0.2, "tvm_version": "0.8.dev0"}
{"input": ["cuda -keys=cuda,gpu -max_num_threads=1024 -thread_warp_size=32", "dense_large_batch.cuda", [["TENSOR", [128, 768], "float32"], ["TENSOR", [2304, 768], "float32"], null, "float32"], {}], "config": {"index": 15840756, "code_hash": null, "entity": [["tile_x", "sp", [-1, 1, 1, 2]], ["tile_y", "sp", [-1, 9, 1, 1]], ["tile_k", "sp", [-1, 8, 12]]]}, "result": [[0.00832342195], 0, 3.4199516773223877, 1609327056.0299602], "version": 0.2, "tvm_version": "0.8.dev0"}
{"input": ["cuda -keys=cuda,gpu -max_num_threads=1024 -thread_warp_size=32", "dense_large_batch.cuda", [["TENSOR", [128, 768], "float32"], ["TENSOR", [2304, 768], "float32"], null, "float32"], {}], "config": {"index": 14058544, "code_hash": null, "entity": [["tile_x", "sp", [-1, 1, 1, 4]], ["tile_y", "sp", [-1, 6, 1, 1]], ["tile_k", "sp", [-1, 12, 8]]]}, "result": [[0.005870492125], 0, 2.8739731311798096, 1609327057.0846581], "version": 0.2, "tvm_version": "0.8.dev0"}
{"input": ["cuda -keys=cuda,gpu -max_num_threads=1024 -thread_warp_size=32", "dense_large_batch.cuda", [["TENSOR", [128, 768], "float32"], ["TENSOR", [2304, 768], "float32"], null, "float32"], {}], "config": {"index": 19238556, "code_hash": null, "entity": [["tile_x", "sp", [-1, 1, 1, 2]], ["tile_y", "sp", [-1, 2, 1, 2]], ["tile_k", "sp", [-1, 8, 24]]]}, "result": [[0.011339028900000001], 0, 3.1682560443878174, 1609327058.140862], "version": 0.2, "tvm_version": "0.8.dev0"}
{"input": ["cuda -keys=cuda,gpu -max_num_threads=1024 -thread_warp_size=32", "dense_large_batch.cuda", [["TENSOR", [128, 768], "float32"], ["TENSOR", [2304, 768], "float32"], null, "float32"], {}], "config": {"index": 14058304, "code_hash": null, "entity": [["tile_x", "sp", [-1, 1, 1, 4]], ["tile_y", "sp", [-1, 3, 1, 1]], ["tile_k", "sp", [-1, 12, 8]]]}, "result": [[0.00770952855], 0, 2.3382973670959473, 1609327058.9716558], "version": 0.2, "tvm_version": "0.8.dev0"}
{"input": ["cuda -keys=cuda,gpu -max_num_threads=1024 -thread_warp_size=32", "dense_large_batch.cuda", [["TENSOR", [128, 768], "float32"], ["TENSOR", [2304, 768], "float32"], null, "float32"], {}], "config": {"index": 19206184, "code_hash": null, "entity": [["tile_x", "sp", [-1, 1, 1, 4]], ["tile_y", "sp", [-1, 2, 1, 1]], ["tile_k", "sp", [-1, 8, 24]]]}, "result": [[0.011256145200000001], 0, 3.230785369873047, 1609327062.7201939], "version": 0.2, "tvm_version": "0.8.dev0"}
{"input": ["cuda -keys=cuda,gpu -max_num_threads=1024 -thread_warp_size=32", "dense_large_batch.cuda", [["TENSOR", [128, 768], "float32"], ["TENSOR", [2304, 768], "float32"], null, "float32"], {}], "config": {"index": 17820156, "code_hash": null, "entity": [["tile_x", "sp", [-1, 1, 1, 2]], ["tile_y", "sp", [-1, 2, 1, 1]], ["tile_k", "sp", [-1, 12, 16]]]}, "result": [[0.012988396650000001], 0, 2.337993860244751, 1609327063.8721337], "version": 0.2, "tvm_version": "0.8.dev0"}
{"input": ["cuda -keys=cuda,gpu -max_num_threads=1024 -thread_warp_size=32", "dense_large_batch.cuda", [["TENSOR", [128, 768], "float32"], ["TENSOR", [2304, 768], "float32"], null, "float32"], {}], "config": {"index": 12078544, "code_hash": null, "entity": [["tile_x", "sp", [-1, 1, 1, 4]], ["tile_y", "sp", [-1, 6, 1, 1]], ["tile_k", "sp", [-1, 16, 6]]]}, "result": [[0.00586567646875], 0, 3.0992445945739746, 1609327064.9220974], "version": 0.2, "tvm_version": "0.8.dev0"}
{"input": ["cuda -keys=cuda,gpu -max_num_threads=1024 -thread_warp_size=32", "dense_large_batch.cuda", [["TENSOR", [128, 768], "float32"], ["TENSOR", [2304, 768], "float32"], null, "float32"], {}], "config": {"index": 17456556, "code_hash": null, "entity": [["tile_x", "sp", [-1, 1, 1, 2]], ["tile_y", "sp", [-1, 2, 1, 2]], ["tile_k", "sp", [-1, 6, 16]]]}, "result": [[0.00974130925], 0, 2.4156312942504883, 1609327066.1156888], "version": 0.2, "tvm_version": "0.8.dev0"}
{"input": ["cuda -keys=cuda,gpu -max_num_threads=1024 -thread_warp_size=32", "dense_large_batch.cuda", [["TENSOR", [128, 768], "float32"], ["TENSOR", [2304, 768], "float32"], null, "float32"], {}], "config": {"index": 19206276, "code_hash": null, "entity": [["tile_x", "sp", [-1, 1, 1, 2]], ["tile_y", "sp", [-1, 3, 1, 1]], ["tile_k", "sp", [-1, 8, 24]]]}, "result": [[0.0111952456], 0, 3.1412854194641113, 1609327067.517977], "version": 0.2, "tvm_version": "0.8.dev0"}
{"input": ["cuda -keys=cuda,gpu -max_num_threads=1024 -thread_warp_size=32", "dense_large_batch.cuda", [["TENSOR", [128, 768], "float32"], ["TENSOR", [2304, 768], "float32"], null, "float32"], {}], "config": {"index": 5544184, "code_hash": null, "entity": [["tile_x", "sp", [-1, 1, 1, 4]], ["tile_y", "sp", [-1, 2, 1, 1]], ["tile_k", "sp", [-1, 48, 2]]]}, "result": [[0.00977823645], 0, 3.0298550128936768, 1609327068.4792302], "version": 0.2, "tvm_version": "0.8.dev0"}
{"input": ["cuda -keys=cuda,gpu -max_num_threads=1024 -thread_warp_size=32", "dense_large_batch.cuda", [["TENSOR", [128, 768], "float32"], ["TENSOR", [2304, 768], "float32"], null, "float32"], {}], "config": {"index": 19280520, "code_hash": null, "entity": [["tile_x", "sp", [-1, 1, 1, 1]], ["tile_y", "sp", [-1, 1, 1, 4]], ["tile_k", "sp", [-1, 8, 24]]]}, "result": [[0.01624465335], 0, 3.427671194076538, 1609327070.1455321], "version": 0.2, "tvm_version": "0.8.dev0"}
{"input": ["cuda -keys=cuda,gpu -max_num_threads=1024 -thread_warp_size=32", "dense_large_batch.cuda", [["TENSOR", [128, 768], "float32"], ["TENSOR", [2304, 768], "float32"], null, "float32"], {}], "config": {"index": 15840600, "code_hash": null, "entity": [["tile_x", "sp", [-1, 1, 1, 1]], ["tile_y", "sp", [-1, 8, 1, 1]], ["tile_k", "sp", [-1, 8, 12]]]}, "result": [[0.01473821065], 0, 3.340562582015991, 1609327071.7089746], "version": 0.2, "tvm_version": "0.8.dev0"}
{"input": ["cuda -keys=cuda,gpu -max_num_threads=1024 -thread_warp_size=32", "dense_large_batch.cuda", [["TENSOR", [128, 768], "float32"], ["TENSOR", [2304, 768], "float32"], null, "float32"], {}], "config": {"index": 14486436, "code_hash": null, "entity": [["tile_x", "sp", [-1, 1, 1, 2]], ["tile_y", "sp", [-1, 1, 1, 2]], ["tile_k", "sp", [-1, 24, 8]]]}, "result": [[0.013074899249999999], 0, 2.8678314685821533, 1609327072.8624403], "version": 0.2, "tvm_version": "0.8.dev0"}
{"input": ["cuda -keys=cuda,gpu -max_num_threads=1024 -thread_warp_size=32", "dense_large_batch.cuda", [["TENSOR", [128, 768], "float32"], ["TENSOR", [2304, 768], "float32"], null, "float32"], {}], "config": {"index": 17456436, "code_hash": null, "entity": [["tile_x", "sp", [-1, 1, 1, 2]], ["tile_y", "sp", [-1, 1, 1, 2]], ["tile_k", "sp", [-1, 6, 16]]]}, "result": [[0.01290498165], 0, 2.193627119064331, 1609327074.0108433], "version": 0.2, "tvm_version": "0.8.dev0"}
{"input": ["cuda -keys=cuda,gpu -max_num_threads=1024 -thread_warp_size=32", "dense_large_batch.cuda", [["TENSOR", [128, 768], "float32"], ["TENSOR", [2304, 768], "float32"], null, "float32"], {}], "config": {"index": 20592156, "code_hash": null, "entity": [["tile_x", "sp", [-1, 1, 1, 2]], ["tile_y", "sp", [-1, 2, 1, 1]], ["tile_k", "sp", [-1, 6, 32]]]}, "result": [[0.013013768649999998], 0, 2.5734729766845703, 1609327075.1653442], "version": 0.2, "tvm_version": "0.8.dev0"}
{"input": ["cuda -keys=cuda,gpu -max_num_threads=1024 -thread_warp_size=32", "dense_large_batch.cuda", [["TENSOR", [128, 768], "float32"], ["TENSOR", [2304, 768], "float32"], null, "float32"], {}], "config": {"index": 14058325, "code_hash": null, "entity": [["tile_x", "sp", [-1, 1, 1, 8]], ["tile_y", "sp", [-1, 3, 1, 1]], ["tile_k", "sp", [-1, 12, 8]]]}, "result": [[0.00728446525], 0, 3.5318241119384766, 1609327076.8891573], "version": 0.2, "tvm_version": "0.8.dev0"}
{"input": ["cuda -keys=cuda,gpu -max_num_threads=1024 -thread_warp_size=32", "dense_large_batch.cuda", [["TENSOR", [128, 768], "float32"], ["TENSOR", [2304, 768], "float32"], null, "float32"], {}], "config": {"index": 20196184, "code_hash": null, "entity": [["tile_x", "sp", [-1, 1, 1, 4]], ["tile_y", "sp", [-1, 2, 1, 1]], ["tile_k", "sp", [-1, 3, 32]]]}, "result": [[0.0098625317], 0, 1.7655994892120361, 1609327077.8556652], "version": 0.2, "tvm_version": "0.8.dev0"}
{"input": ["cuda -keys=cuda,gpu -max_num_threads=1024 -thread_warp_size=32", "dense_large_batch.cuda", [["TENSOR", [128, 768], "float32"], ["TENSOR", [2304, 768], "float32"], null, "float32"], {}], "config": {"index": 17456584, "code_hash": null, "entity": [["tile_x", "sp", [-1, 1, 1, 4]], ["tile_y", "sp", [-1, 2, 1, 2]], ["tile_k", "sp", [-1, 6, 16]]]}, "result": [[0.006811054875], 0, 3.169811487197876, 1609327199.8741856], "version": 0.2, "tvm_version": "0.8.dev0"}
{"input": ["cuda -keys=cuda,gpu -max_num_threads=1024 -thread_warp_size=32", "dense_large_batch.cuda", [["TENSOR", [128, 768], "float32"], ["TENSOR", [2304, 768], "float32"], null, "float32"], {}], "config": {"index": 15872584, "code_hash": null, "entity": [["tile_x", "sp", [-1, 1, 1, 4]], ["tile_y", "sp", [-1, 2, 1, 2]], ["tile_k", "sp", [-1, 8, 12]]]}, "result": [[0.006809920875], 0, 2.9761123657226562, 1609327201.0229166], "version": 0.2, "tvm_version": "0.8.dev0"}
{"input": ["cuda -keys=cuda,gpu -max_num_threads=1024 -thread_warp_size=32", "dense_large_batch.cuda", [["TENSOR", [128, 768], "float32"], ["TENSOR", [2304, 768], "float32"], null, "float32"], {}], "config": {"index": 14256424, "code_hash": null, "entity": [["tile_x", "sp", [-1, 1, 1, 4]], ["tile_y", "sp", [-1, 4, 1, 1]], ["tile_k", "sp", [-1, 16, 8]]]}, "result": [[0.0092769136], 0, 3.0777652263641357, 1609327201.955729], "version": 0.2, "tvm_version": "0.8.dev0"}
{"input": ["cuda -keys=cuda,gpu -max_num_threads=1024 -thread_warp_size=32", "dense_large_batch.cuda", [["TENSOR", [128, 768], "float32"], ["TENSOR", [2304, 768], "float32"], null, "float32"], {}], "config": {"index": 12276276, "code_hash": null, "entity": [["tile_x", "sp", [-1, 1, 1, 2]], ["tile_y", "sp", [-1, 3, 1, 1]], ["tile_k", "sp", [-1, 32, 6]]]}, "result": [[0.0108314869], 0, 3.365447759628296, 1609327202.9534864], "version": 0.2, "tvm_version": "0.8.dev0"}
{"input": ["cuda -keys=cuda,gpu -max_num_threads=1024 -thread_warp_size=32", "dense_large_batch.cuda", [["TENSOR", [128, 768], "float32"], ["TENSOR", [2304, 768], "float32"], null, "float32"], {}], "config": {"index": 17424304, "code_hash": null, "entity": [["tile_x", "sp", [-1, 1, 1, 4]], ["tile_y", "sp", [-1, 3, 1, 1]], ["tile_k", "sp", [-1, 6, 16]]]}, "result": [[0.00752148459375], 0, 2.6562774181365967, 1609327204.1666377], "version": 0.2, "tvm_version": "0.8.dev0"}
{"input": ["cuda -keys=cuda,gpu -max_num_threads=1024 -thread_warp_size=32", "dense_large_batch.cuda", [["TENSOR", [128, 768], "float32"], ["TENSOR", [2304, 768], "float32"], null, "float32"], {}], "config": {"index": 13860424, "code_hash": null, "entity": [["tile_x", "sp", [-1, 1, 1, 4]], ["tile_y", "sp", [-1, 4, 1, 1]], ["tile_k", "sp", [-1, 8, 8]]]}, "result": [[0.00898275565], 0, 2.4932823181152344, 1609327205.3058655], "version": 0.2, "tvm_version": "0.8.dev0"}
{"input": ["cuda -keys=cuda,gpu -max_num_threads=1024 -thread_warp_size=32", "dense_large_batch.cuda", [["TENSOR", [128, 768], "float32"], ["TENSOR", [2304, 768], "float32"], null, "float32"], {}], "config": {"index": 13662325, "code_hash": null, "entity": [["tile_x", "sp", [-1, 1, 1, 8]], ["tile_y", "sp", [-1, 3, 1, 1]], ["tile_k", "sp", [-1, 6, 8]]]}, "result": [[0.00561446953125], 0, 2.552232265472412, 1609327206.5712318], "version": 0.2, "tvm_version": "0.8.dev0"}
{"input": ["cuda -keys=cuda,gpu -max_num_threads=1024 -thread_warp_size=32", "dense_large_batch.cuda", [["TENSOR", [128, 768], "float32"], ["TENSOR", [2304, 768], "float32"], null, "float32"], {}], "config": {"index": 12078325, "code_hash": null, "entity": [["tile_x", "sp", [-1, 1, 1, 8]], ["tile_y", "sp", [-1, 3, 1, 1]], ["tile_k", "sp", [-1, 16, 6]]]}, "result": [[0.0071176320625], 0, 3.5770366191864014, 1609327207.756989], "version": 0.2, "tvm_version": "0.8.dev0"}
{"input": ["cuda -keys=cuda,gpu -max_num_threads=1024 -thread_warp_size=32", "dense_large_batch.cuda", [["TENSOR", [128, 768], "float32"], ["TENSOR", [2304, 768], "float32"], null, "float32"], {}], "config": {"index": 14090704, "code_hash": null, "entity": [["tile_x", "sp", [-1, 1, 1, 4]], ["tile_y", "sp", [-1, 3, 1, 2]], ["tile_k", "sp", [-1, 12, 8]]]}, "result": [[0.00568323959375], 0, 3.6543264389038086, 1609327209.2884421], "version": 0.2, "tvm_version": "0.8.dev0"}
{"input": ["cuda -keys=cuda,gpu -max_num_threads=1024 -thread_warp_size=32", "dense_large_batch.cuda", [["TENSOR", [128, 768], "float32"], ["TENSOR", [2304, 768], "float32"], null, "float32"], {}], "config": {"index": 11880325, "code_hash": null, "entity": [["tile_x", "sp", [-1, 1, 1, 8]], ["tile_y", "sp", [-1, 3, 1, 1]], ["tile_k", "sp", [-1, 8, 6]]]}, "result": [[0.0056168281875], 0, 2.3785829544067383, 1609327210.2970715], "version": 0.2, "tvm_version": "0.8.dev0"}
{"input": ["cuda -keys=cuda,gpu -max_num_threads=1024 -thread_warp_size=32", "dense_large_batch.cuda", [["TENSOR", [128, 768], "float32"], ["TENSOR", [2304, 768], "float32"], null, "float32"], {}], "config": {"index": 14256304, "code_hash": null, "entity": [["tile_x", "sp", [-1, 1, 1, 4]], ["tile_y", "sp", [-1, 3, 1, 1]], ["tile_k", "sp", [-1, 16, 8]]]}, "result": [[0.00965675035], 0, 3.248302698135376, 1609327211.6240335], "version": 0.2, "tvm_version": "0.8.dev0"}
{"input": ["cuda -keys=cuda,gpu -max_num_threads=1024 -thread_warp_size=32", "dense_large_batch.cuda", [["TENSOR", [128, 768], "float32"], ["TENSOR", [2304, 768], "float32"], null, "float32"], {}], "config": {"index": 13860325, "code_hash": null, "entity": [["tile_x", "sp", [-1, 1, 1, 8]], ["tile_y", "sp", [-1, 3, 1, 1]], ["tile_k", "sp", [-1, 8, 8]]]}, "result": [[0.007421838625], 0, 3.1022884845733643, 1609327213.1904664], "version": 0.2, "tvm_version": "0.8.dev0"}
{"input": ["cuda -keys=cuda,gpu -max_num_threads=1024 -thread_warp_size=32", "dense_large_batch.cuda", [["TENSOR", [128, 768], "float32"], ["TENSOR", [2304, 768], "float32"], null, "float32"], {}], "config": {"index": 10098424, "code_hash": null, "entity": [["tile_x", "sp", [-1, 1, 1, 4]], ["tile_y", "sp", [-1, 4, 1, 1]], ["tile_k", "sp", [-1, 24, 4]]]}, "result": [[0.006846470375], 0, 3.044701099395752, 1609327214.3507218], "version": 0.2, "tvm_version": "0.8.dev0"}
{"input": ["cuda -keys=cuda,gpu -max_num_threads=1024 -thread_warp_size=32", "dense_large_batch.cuda", [["TENSOR", [128, 768], "float32"], ["TENSOR", [2304, 768], "float32"], null, "float32"], {}], "config": {"index": 14090584, "code_hash": null, "entity": [["tile_x", "sp", [-1, 1, 1, 4]], ["tile_y", "sp", [-1, 2, 1, 2]], ["tile_k", "sp", [-1, 12, 8]]]}, "result": [[0.007961256949999999], 0, 2.946871280670166, 1609327218.5998654], "version": 0.2, "tvm_version": "0.8.dev0"}
