saved_logs/2020_01_11/autotvm/t4/bert-B1-float32.kernel.log
{"input": ["cuda -keys=cuda,gpu -max_num_threads=1024 -model=t4 -thread_warp_size=32", "dense_small_batch.cuda", [["TENSOR", [1, 768], "float32"], ["TENSOR", [768, 768], "float32"], null, "float32"], {}], "config": {"index": 5, "code_hash": null, "entity": [["tile_k", "sp", [-1, 8]]]}, "result": [[8.291627832384894e-06], 0, 1.4589149951934814, 1610298238.3852098], "version": 0.2, "tvm_version": "0.8.dev0"}
{"input": ["cuda -keys=cuda,gpu -max_num_threads=1024 -model=t4 -thread_warp_size=32", "dense_small_batch.cuda", [["TENSOR", [1, 768], "float32"], ["TENSOR", [768, 768], "float32"], null, "float32"], {}], "config": {"index": 7, "code_hash": null, "entity": [["tile_k", "sp", [-1, 16]]]}, "result": [[5.844622823438902e-06], 0, 1.5458409786224365, 1610298239.626442], "version": 0.2, "tvm_version": "0.8.dev0"}
{"input": ["cuda -keys=cuda,gpu -max_num_threads=1024 -model=t4 -thread_warp_size=32", "dense_small_batch.cuda", [["TENSOR", [1, 768], "float32"], ["TENSOR", [768, 768], "float32"], null, "float32"], {}], "config": {"index": 1, "code_hash": null, "entity": [["tile_k", "sp", [-1, 2]]]}, "result": [[2.4438267621717012e-05], 0, 1.5500154495239258, 1610298240.9016688], "version": 0.2, "tvm_version": "0.8.dev0"}
{"input": ["cuda -keys=cuda,gpu -max_num_threads=1024 -model=t4 -thread_warp_size=32", "dense_small_batch.cuda", [["TENSOR", [1, 768], "float32"], ["TENSOR", [768, 768], "float32"], null, "float32"], {}], "config": {"index": 4, "code_hash": null, "entity": [["tile_k", "sp", [-1, 6]]]}, "result": [[1.032737919391375e-05], 0, 1.716806173324585, 1610298242.191575], "version": 0.2, "tvm_version": "0.8.dev0"}
{"input": ["cuda -keys=cuda,gpu -max_num_threads=1024 -model=t4 -thread_warp_size=32", "dense_small_batch.cuda", [["TENSOR", [1, 768], "float32"], ["TENSOR", [768, 768], "float32"], null, "float32"], {}], "config": {"index": 11, "code_hash": null, "entity": [["tile_k", "sp", [-1, 64]]]}, "result": [[4.574042600986803e-06], 0, 1.6027722358703613, 1610298243.4315271], "version": 0.2, "tvm_version": "0.8.dev0"}
{"input": ["cuda -keys=cuda,gpu -max_num_threads=1024 -model=t4 -thread_warp_size=32", "dense_small_batch.cuda", [["TENSOR", [1, 768], "float32"], ["TENSOR", [768, 768], "float32"], null, "float32"], {}], "config": {"index": 0, "code_hash": null, "entity": [["tile_k", "sp", [-1, 1]]]}, "result": [[4.788446805946163e-05], 0, 1.807708501815796, 1610298244.7155244], "version": 0.2, "tvm_version": "0.8.dev0"}
{"input": ["cuda -keys=cuda,gpu -max_num_threads=1024 -model=t4 -thread_warp_size=32", "dense_small_batch.cuda", [["TENSOR", [1, 768], "float32"], ["TENSOR", [768, 768], "float32"], null, "float32"], {}], "config": {"index": 13, "code_hash": null, "entity": [["tile_k", "sp", [-1, 128]]]}, "result": [[5.2169211888957324e-06], 0, 1.736607551574707, 1610298245.9587748], "version": 0.2, "tvm_version": "0.8.dev0"}
{"input": ["cuda -keys=cuda,gpu -max_num_threads=1024 -model=t4 -thread_warp_size=32", "dense_small_batch.cuda", [["TENSOR", [1, 768], "float32"], ["TENSOR", [768, 768], "float32"], null, "float32"], {}], "config": {"index": 8, "code_hash": null, "entity": [["tile_k", "sp", [-1, 24]]]}, "result": [[5.127086473559519e-06], 0, 1.6652679443359375, 1610298247.2074637], "version": 0.2, "tvm_version": "0.8.dev0"}
{"input": ["cuda -keys=cuda,gpu -max_num_threads=1024 -model=t4 -thread_warp_size=32", "dense_small_batch.cuda", [["TENSOR", [1, 768], "float32"], ["TENSOR", [768, 768], "float32"], null, "float32"], {}], "config": {"index": 10, "code_hash": null, "entity": [["tile_k", "sp", [-1, 48]]]}, "result": [[5.075544931404941e-06], 0, 1.7153265476226807, 1610298248.4635026], "version": 0.2, "tvm_version": "0.8.dev0"}
{"input": ["cuda -keys=cuda,gpu -max_num_threads=1024 -model=t4 -thread_warp_size=32", "dense_small_batch.cuda", [["TENSOR", [1, 768], "float32"], ["TENSOR", [768, 768], "float32"], null, "float32"], {}], "config": {"index": 16, "code_hash": null, "entity": [["tile_k", "sp", [-1, 384]]]}, "result": [[1.2344643322216928e-05], 0, 1.739924669265747, 1610298249.7231953], "version": 0.2, "tvm_version": "0.8.dev0"}
{"input": ["cuda -keys=cuda,gpu -max_num_threads=1024 -model=t4 -thread_warp_size=32", "dense_small_batch.cuda", [["TENSOR", [1, 768], "float32"], ["TENSOR", [768, 768], "float32"], null, "float32"], {}], "config": {"index": 3, "code_hash": null, "entity": [["tile_k", "sp", [-1, 4]]]}, "result": [[1.3609583530205872e-05], 0, 1.7133769989013672, 1610298251.0133348], "version": 0.2, "tvm_version": "0.8.dev0"}
{"input": ["cuda -keys=cuda,gpu -max_num_threads=1024 -model=t4 -thread_warp_size=32", "dense_small_batch.cuda", [["TENSOR", [1, 768], "float32"], ["TENSOR", [768, 768], "float32"], null, "float32"], {}], "config": {"index": 15, "code_hash": null, "entity": [["tile_k", "sp", [-1, 256]]]}, "result": [[7.35050819725457e-06], 0, 1.6320009231567383, 1610298252.2546408], "version": 0.2, "tvm_version": "0.8.dev0"}
{"input": ["cuda -keys=cuda,gpu -max_num_threads=1024 -model=t4 -thread_warp_size=32", "dense_small_batch.cuda", [["TENSOR", [1, 768], "float32"], ["TENSOR", [768, 768], "float32"], null, "float32"], {}], "config": {"index": 9, "code_hash": null, "entity": [["tile_k", "sp", [-1, 32]]]}, "result": [[4.0454768754189236e-06], 0, 1.618582010269165, 1610298253.47943], "version": 0.2, "tvm_version": "0.8.dev0"}
{"input": ["cuda -keys=cuda,gpu -max_num_threads=1024 -model=t4 -thread_warp_size=32", "dense_small_batch.cuda", [["TENSOR", [1, 768], "float32"], ["TENSOR", [768, 768], "float32"], null, "float32"], {}], "config": {"index": 12, "code_hash": null, "entity": [["tile_k", "sp", [-1, 96]]]}, "result": [[4.958460385578913e-06], 0, 1.6141016483306885, 1610298254.7234478], "version": 0.2, "tvm_version": "0.8.dev0"}
{"input": ["cuda -keys=cuda,gpu -max_num_threads=1024 -model=t4 -thread_warp_size=32", "dense_small_batch.cuda", [["TENSOR", [1, 768], "float32"], ["TENSOR", [768, 768], "float32"], null, "float32"], {}], "config": {"index": 2, "code_hash": null, "entity": [["tile_k", "sp", [-1, 3]]]}, "result": [[1.771649424014178e-05], 0, 1.6670255661010742, 1610298256.0096612], "version": 0.2, "tvm_version": "0.8.dev0"}
{"input": ["cuda -keys=cuda,gpu -max_num_threads=1024 -model=t4 -thread_warp_size=32", "dense_small_batch.cuda", [["TENSOR", [1, 768], "float32"], ["TENSOR", [768, 768], "float32"], null, "float32"], {}], "config": {"index": 14, "code_hash": null, "entity": [["tile_k", "sp", [-1, 192]]]}, "result": [[6.416548033325776e-06], 0, 1.519284725189209, 1610298257.249456], "version": 0.2, "tvm_version": "0.8.dev0"}
{"input": ["cuda -keys=cuda,gpu -max_num_threads=1024 -model=t4 -thread_warp_size=32", "dense_small_batch.cuda", [["TENSOR", [1, 768], "float32"], ["TENSOR", [768, 768], "float32"], null, "float32"], {}], "config": {"index": 17, "code_hash": null, "entity": [["tile_k", "sp", [-1, 768]]]}, "result": [[2.5938314419008355e-05], 0, 1.4731190204620361, 1610298259.0785162], "version": 0.2, "tvm_version": "0.8.dev0"}
{"input": ["cuda -keys=cuda,gpu -max_num_threads=1024 -model=t4 -thread_warp_size=32", "dense_small_batch.cuda", [["TENSOR", [1, 768], "float32"], ["TENSOR", [768, 768], "float32"], null, "float32"], {}], "config": {"index": 6, "code_hash": null, "entity": [["tile_k", "sp", [-1, 12]]]}, "result": [[7.040244615069015e-06], 0, 1.4771316051483154, 1610298260.3651779], "version": 0.2, "tvm_version": "0.8.dev0"}
{"input": ["cuda -keys=cuda,gpu -max_num_threads=1024 -model=t4 -thread_warp_size=32", "dense_large_batch.cuda", [["TENSOR", [128, 768], "float32"], ["TENSOR", [2304, 768], "float32"], null, "float32"], {}], "config": {"index": 307813, "code_hash": null, "entity": [["tile_x", "sp", [-1, 32, 2, 1]], ["tile_y", "sp", [-1, 1, 2, 8]], ["tile_k", "sp", [-1, 2, 1]]]}, "result": [[0.0047165179375], 0, 2.2346200942993164, 1610298275.188114], "version": 0.2, "tvm_version": "0.8.dev0"}
{"input": ["cuda -keys=cuda,gpu -max_num_threads=1024 -model=t4 -thread_warp_size=32", "dense_large_batch.cuda", [["TENSOR", [128, 768], "float32"], ["TENSOR", [2304, 768], "float32"], null, "float32"], {}], "config": {"index": 1418402, "code_hash": null, "entity": [["tile_x", "sp", [-1, 4, 1, 1]], ["tile_y", "sp", [-1, 1, 1, 2]], ["tile_k", "sp", [-1, 16, 1]]]}, "result": [[0.009550332849999999], 0, 1.5808069705963135, 1610298316.798952], "version": 0.2, "tvm_version": "0.8.dev0"}
{"input": ["cuda -keys=cuda,gpu -max_num_threads=1024 -model=t4 -thread_warp_size=32", "dense_large_batch.cuda", [["TENSOR", [128, 768], "float32"], ["TENSOR", [2304, 768], "float32"], null, "float32"], {}], "config": {"index": 1418488, "code_hash": null, "entity": [["tile_x", "sp", [-1, 8, 1, 8]], ["tile_y", "sp", [-1, 1, 1, 2]], ["tile_k", "sp", [-1, 16, 1]]]}, "result": [[0.0080277703], 0, 3.573046922683716, 1610298318.820629], "version": 0.2, "tvm_version": "0.8.dev0"}
{"input": ["cuda -keys=cuda,gpu -max_num_threads=1024 -model=t4 -thread_warp_size=32", "dense_large_batch.cuda", [["TENSOR", [128, 768], "float32"], ["TENSOR", [2304, 768], "float32"], null, "float32"], {}], "config": {"index": 396156, "code_hash": null, "entity": [["tile_x", "sp", [-1, 1, 1, 2]], ["tile_y", "sp", [-1, 2, 1, 1]], ["tile_k", "sp", [-1, 3, 1]]]}, "result": [[0.014949396949999999], 0, 2.2393178939819336, 1610298320.871562], "version": 0.2, "tvm_version": "0.8.dev0"}
{"input": ["cuda -keys=cuda,gpu -max_num_threads=1024 -model=t4 -thread_warp_size=32", "dense_large_batch.cuda", [["TENSOR", [128, 768], "float32"], ["TENSOR", [2304, 768], "float32"], null, "float32"], {}], "config": {"index": 12878331, "code_hash": null, "entity": [["tile_x", "sp", [-1, 4, 4, 2]], ["tile_y", "sp", [-1, 1, 4, 1]], ["tile_k", "sp", [-1, 1, 8]]]}, "result": [[0.002465343756097561], 0, 1.750486135482788, 1610298326.5373847], "version": 0.2, "tvm_version": "0.8.dev0"}
{"input": ["cuda -keys=cuda,gpu -max_num_threads=1024 -model=t4 -thread_warp_size=32", "dense_large_batch.cuda", [["TENSOR", [128, 768], "float32"], ["TENSOR", [2304, 768], "float32"], null, "float32"], {}], "config": {"index": 4158220, "code_hash": null, "entity": [["tile_x", "sp", [-1, 1, 1, 16]], ["tile_y", "sp", [-1, 2, 1, 1]], ["tile_k", "sp", [-1, 4, 2]]]}, "result": [[0.0068733556875], 0, 1.7105863094329834, 1610298327.8462057], "version": 0.2, "tvm_version": "0.8.dev0"}
{"input": ["cuda -keys=cuda,gpu -max_num_threads=1024 -model=t4 -thread_warp_size=32", "dense_large_batch.cuda", [["TENSOR", [128, 768], "float32"], ["TENSOR", [2304, 768], "float32"], null, "float32"], {}], "config": {"index": 1418511, "code_hash": null, "entity": [["tile_x", "sp", [-1, 2, 1, 32]], ["tile_y", "sp", [-1, 1, 1, 2]], ["tile_k", "sp", [-1, 16, 1]]]}, "result": [[0.00826923215], 0, 3.522414445877075, 1610298329.7803118], "version": 0.2, "tvm_version": "0.8.dev0"}
{"input": ["cuda -keys=cuda,gpu -max_num_threads=1024 -model=t4 -thread_warp_size=32", "dense_large_batch.cuda", [["TENSOR", [128, 768], "float32"], ["TENSOR", [2304, 768], "float32"], null, "float32"], {}], "config": {"index": 1418516, "code_hash": null, "entity": [["tile_x", "sp", [-1, 1, 1, 64]], ["tile_y", "sp", [-1, 1, 1, 2]], ["tile_k", "sp", [-1, 16, 1]]]}, "result": [[0.0084800677], 0, 4.33811092376709, 1610298331.7426062], "version": 0.2, "tvm_version": "0.8.dev0"}
{"input": ["cuda -keys=cuda,gpu -max_num_threads=1024 -model=t4 -thread_warp_size=32", "dense_large_batch.cuda", [["TENSOR", [128, 768], "float32"], ["TENSOR", [2304, 768], "float32"], null, "float32"], {}], "config": {"index": 4158156, "code_hash": null, "entity": [["tile_x", "sp", [-1, 1, 1, 2]], ["tile_y", "sp", [-1, 2, 1, 1]], ["tile_k", "sp", [-1, 4, 2]]]}, "result": [[0.013401634249999999], 0, 2.1022398471832275, 1610298333.7970378], "version": 0.2, "tvm_version": "0.8.dev0"}
{"input": ["cuda -keys=cuda,gpu -max_num_threads=1024 -model=t4 -thread_warp_size=32", "dense_large_batch.cuda", [["TENSOR", [128, 768], "float32"], ["TENSOR", [2304, 768], "float32"], null, "float32"], {}], "config": {"index": 3599611, "code_hash": null, "entity": [["tile_x", "sp", [-1, 2, 2, 8]], ["tile_y", "sp", [-1, 3, 2, 2]], ["tile_k", "sp", [-1, 1, 2]]]}, "result": [[0.002769986890909091], 0, 1.4333431720733643, 1610298334.9325254], "version": 0.2, "tvm_version": "0.8.dev0"}
{"input": ["cuda -keys=cuda,gpu -max_num_threads=1024 -model=t4 -thread_warp_size=32", "dense_large_batch.cuda", [["TENSOR", [128, 768], "float32"], ["TENSOR", [2304, 768], "float32"], null, "float32"], {}], "config": {"index": 3564230, "code_hash": null, "entity": [["tile_x", "sp", [-1, 1, 1, 32]], ["tile_y", "sp", [-1, 2, 1, 1]], ["tile_k", "sp", [-1, 1, 2]]]}, "result": [[0.0078854617], 0, 1.7178502082824707, 1610298429.500374], "version": 0.2, "tvm_version": "0.8.dev0"}
{"input": ["cuda -keys=cuda,gpu -max_num_threads=1024 -model=t4 -thread_warp_size=32", "dense_large_batch.cuda", [["TENSOR", [128, 768], "float32"], ["TENSOR", [2304, 768], "float32"], null, "float32"], {}], "config": {"index": 3762230, "code_hash": null, "entity": [["tile_x", "sp", [-1, 1, 1, 32]], ["tile_y", "sp", [-1, 2, 1, 1]], ["tile_k", "sp", [-1, 2, 2]]]}, "result": [[0.00622294565625], 0, 1.7275958061218262, 1610298430.7589114], "version": 0.2, "tvm_version": "0.8.dev0"}
{"input": ["cuda -keys=cuda,gpu -max_num_threads=1024 -model=t4 -thread_warp_size=32", "dense_large_batch.cuda", [["TENSOR", [128, 768], "float32"], ["TENSOR", [2304, 768], "float32"], null, "float32"], {}], "config": {"index": 198230, "code_hash": null, "entity": [["tile_x", "sp", [-1, 1, 1, 32]], ["tile_y", "sp", [-1, 2, 1, 1]], ["tile_k", "sp", [-1, 2, 1]]]}, "result": [[0.0066025814375], 0, 1.7849664688110352, 1610298436.3510668], "version": 0.2, "tvm_version": "0.8.dev0"}
{"input": ["cuda -keys=cuda,gpu -max_num_threads=1024 -model=t4 -thread_warp_size=32", "dense_large_batch.cuda", [["TENSOR", [128, 768], "float32"], ["TENSOR", [2304, 768], "float32"], null, "float32"], {}], "config": {"index": 198110, "code_hash": null, "entity": [["tile_x", "sp", [-1, 1, 1, 32]], ["tile_y", "sp", [-1, 1, 1, 1]], ["tile_k", "sp", [-1, 2, 1]]]}, "result": [[0.012104961899999999], 0, 1.8364660739898682, 1610298437.5947843], "version": 0.2, "tvm_version": "0.8.dev0"}
{"input": ["cuda -keys=cuda,gpu -max_num_threads=1024 -model=t4 -thread_warp_size=32", "dense_large_batch.cuda", [["TENSOR", [128, 768], "float32"], ["TENSOR", [2304, 768], "float32"], null, "float32"], {}], "config": {"index": 3762221, "code_hash": null, "entity": [["tile_x", "sp", [-1, 2, 1, 16]], ["tile_y", "sp", [-1, 2, 1, 1]], ["tile_k", "sp", [-1, 2, 2]]]}, "result": [[0.00622738053125], 0, 1.978694200515747, 1610298438.8525443], "version": 0.2, "tvm_version": "0.8.dev0"}
{"input": ["cuda -keys=cuda,gpu -max_num_threads=1024 -model=t4 -thread_warp_size=32", "dense_large_batch.cuda", [["TENSOR", [128, 768], "float32"], ["TENSOR", [2304, 768], "float32"], null, "float32"], {}], "config": {"index": 32486, "code_hash": null, "entity": [["tile_x", "sp", [-1, 2, 1, 8]], ["tile_y", "sp", [-1, 1, 1, 2]], ["tile_k", "sp", [-1, 1, 1]]]}, "result": [[0.0074675559375], 0, 1.954195499420166, 1610298440.207284], "version": 0.2, "tvm_version": "0.8.dev0"}
{"input": ["cuda -keys=cuda,gpu -max_num_threads=1024 -model=t4 -thread_warp_size=32", "dense_large_batch.cuda", [["TENSOR", [128, 768], "float32"], ["TENSOR", [2304, 768], "float32"], null, "float32"], {}], "config": {"index": 58406, "code_hash": null, "entity": [["tile_x", "sp", [-1, 2, 1, 8]], ["tile_y", "sp", [-1, 1, 1, 3]], ["tile_k", "sp", [-1, 1, 1]]]}, "result": [[0.0055937356875], 0, 1.7828104496002197, 1610298441.354408], "version": 0.2, "tvm_version": "0.8.dev0"}
{"input": ["cuda -keys=cuda,gpu -max_num_threads=1024 -model=t4 -thread_warp_size=32", "dense_large_batch.cuda", [["TENSOR", [128, 768], "float32"], ["TENSOR", [2304, 768], "float32"], null, "float32"], {}], "config": {"index": 32500, "code_hash": null, "entity": [["tile_x", "sp", [-1, 1, 1, 16]], ["tile_y", "sp", [-1, 1, 1, 2]], ["tile_k", "sp", [-1, 1, 1]]]}, "result": [[0.00746702996875], 0, 1.9484436511993408, 1610298442.711083], "version": 0.2, "tvm_version": "0.8.dev0"}
{"input": ["cuda -keys=cuda,gpu -max_num_threads=1024 -model=t4 -thread_warp_size=32", "dense_large_batch.cuda", [["TENSOR", [128, 768], "float32"], ["TENSOR", [2304, 768], "float32"], null, "float32"], {}], "config": {"index": 74620, "code_hash": null, "entity": [["tile_x", "sp", [-1, 1, 1, 16]], ["tile_y", "sp", [-1, 1, 1, 4]], ["tile_k", "sp", [-1, 1, 1]]]}, "result": [[0.00389775358974359], 0, 1.685960054397583, 1610298443.7410796], "version": 0.2, "tvm_version": "0.8.dev0"}
{"input": ["cuda -keys=cuda,gpu -max_num_threads=1024 -model=t4 -thread_warp_size=32", "dense_large_batch.cuda", [["TENSOR", [128, 768], "float32"], ["TENSOR", [2304, 768], "float32"], null, "float32"], {}], "config": {"index": 74605, "code_hash": null, "entity": [["tile_x", "sp", [-1, 1, 1, 8]], ["tile_y", "sp", [-1, 1, 1, 4]], ["tile_k", "sp", [-1, 1, 1]]]}, "result": [[0.0070359319375], 0, 1.8965275287628174, 1610298445.0524082], "version": 0.2, "tvm_version": "0.8.dev0"}
{"input": ["cuda -keys=cuda,gpu -max_num_threads=1024 -model=t4 -thread_warp_size=32", "dense_large_batch.cuda", [["TENSOR", [128, 768], "float32"], ["TENSOR", [2304, 768], "float32"], null, "float32"], {}], "config": {"index": 198065, "code_hash": null, "entity": [["tile_x", "sp", [-1, 2, 1, 4]], ["tile_y", "sp", [-1, 1, 1, 1]], ["tile_k", "sp", [-1, 2, 1]]]}, "result": [[0.02067327045], 0, 2.3224709033966064, 1610298446.7932575], "version": 0.2, "tvm_version": "0.8.dev0"}
{"input": ["cuda -keys=cuda,gpu -max_num_threads=1024 -model=t4 -thread_warp_size=32", "dense_large_batch.cuda", [["TENSOR", [128, 768], "float32"], ["TENSOR", [2304, 768], "float32"], null, "float32"], {}], "config": {"index": 58405, "code_hash": null, "entity": [["tile_x", "sp", [-1, 1, 1, 8]], ["tile_y", "sp", [-1, 1, 1, 3]], ["tile_k", "sp", [-1, 1, 1]]]}, "result": [[0.00934391555], 0, 1.548732042312622, 1610298447.8458097], "version": 0.2, "tvm_version": "0.8.dev0"}
{"input": ["cuda -keys=cuda,gpu -max_num_threads=1024 -model=t4 -thread_warp_size=32", "dense_large_batch.cuda", [["TENSOR", [128, 768], "float32"], ["TENSOR", [2304, 768], "float32"], null, "float32"], {}], "config": {"index": 230465, "code_hash": null, "entity": [["tile_x", "sp", [-1, 2, 1, 4]], ["tile_y", "sp", [-1, 1, 1, 2]], ["tile_k", "sp", [-1, 2, 1]]]}, "result": [[0.0112965643], 0, 1.7056159973144531, 1610298449.0228817], "version": 0.2, "tvm_version": "0.8.dev0"}
{"input": ["cuda -keys=cuda,gpu -max_num_threads=1024 -model=t4 -thread_warp_size=32", "dense_large_batch.cuda", [["TENSOR", [128, 768], "float32"], ["TENSOR", [2304, 768], "float32"], null, "float32"], {}], "config": {"index": 594036, "code_hash": null, "entity": [["tile_x", "sp", [-1, 1, 1, 2]], ["tile_y", "sp", [-1, 1, 1, 1]], ["tile_k", "sp", [-1, 4, 1]]]}, "result": [[0.0202617417], 0, 2.4689154624938965, 1610298451.0600603], "version": 0.2, "tvm_version": "0.8.dev0"}
{"input": ["cuda -keys=cuda,gpu -max_num_threads=1024 -model=t4 -thread_warp_size=32", "dense_large_batch.cuda", [["TENSOR", [128, 768], "float32"], ["TENSOR", [2304, 768], "float32"], null, "float32"], {}], "config": {"index": 230464, "code_hash": null, "entity": [["tile_x", "sp", [-1, 1, 1, 4]], ["tile_y", "sp", [-1, 1, 1, 2]], ["tile_k", "sp", [-1, 2, 1]]]}, "result": [[0.013978245750000002], 0, 1.750495195388794, 1610298452.3910794], "version": 0.2, "tvm_version": "0.8.dev0"}
{"input": ["cuda -keys=cuda,gpu -max_num_threads=1024 -model=t4 -thread_warp_size=32", "dense_large_batch.cuda", [["TENSOR", [128, 768], "float32"], ["TENSOR", [2304, 768], "float32"], null, "float32"], {}], "config": {"index": 3638606, "code_hash": null, "entity": [["tile_x", "sp", [-1, 2, 1, 8]], ["tile_y", "sp", [-1, 1, 1, 4]], ["tile_k", "sp", [-1, 1, 2]]]}, "result": [[0.003833367176470588], 0, 1.7252357006072998, 1610298455.539869], "version": 0.2, "tvm_version": "0.8.dev0"}
{"input": ["cuda -keys=cuda,gpu -max_num_threads=1024 -model=t4 -thread_warp_size=32", "dense_large_batch.cuda", [["TENSOR", [128, 768], "float32"], ["TENSOR", [2304, 768], "float32"], null, "float32"], {}], "config": {"index": 230486, "code_hash": null, "entity": [["tile_x", "sp", [-1, 2, 1, 8]], ["tile_y", "sp", [-1, 1, 1, 2]], ["tile_k", "sp", [-1, 2, 1]]]}, "result": [[0.0066709344375], 0, 1.6769020557403564, 1610298456.8102636], "version": 0.2, "tvm_version": "0.8.dev0"}
{"input": ["cuda -keys=cuda,gpu -max_num_threads=1024 -model=t4 -thread_warp_size=32", "dense_large_batch.cuda", [["TENSOR", [128, 768], "float32"], ["TENSOR", [2304, 768], "float32"], null, "float32"], {}], "config": {"index": 272605, "code_hash": null, "entity": [["tile_x", "sp", [-1, 1, 1, 8]], ["tile_y", "sp", [-1, 1, 1, 4]], ["tile_k", "sp", [-1, 2, 1]]]}, "result": [[0.00676282325], 0, 1.6720731258392334, 1610298458.0898583], "version": 0.2, "tvm_version": "0.8.dev0"}
{"input": ["cuda -keys=cuda,gpu -max_num_threads=1024 -model=t4 -thread_warp_size=32", "dense_large_batch.cuda", [["TENSOR", [128, 768], "float32"], ["TENSOR", [2304, 768], "float32"], null, "float32"], {}], "config": {"index": 230466, "code_hash": null, "entity": [["tile_x", "sp", [-1, 4, 1, 4]], ["tile_y", "sp", [-1, 1, 1, 2]], ["tile_k", "sp", [-1, 2, 1]]]}, "result": [[0.00667032528125], 0, 1.7314813137054443, 1610298459.3588562], "version": 0.2, "tvm_version": "0.8.dev0"}
{"input": ["cuda -keys=cuda,gpu -max_num_threads=1024 -model=t4 -thread_warp_size=32", "dense_large_batch.cuda", [["TENSOR", [128, 768], "float32"], ["TENSOR", [2304, 768], "float32"], null, "float32"], {}], "config": {"index": 428466, "code_hash": null, "entity": [["tile_x", "sp", [-1, 4, 1, 4]], ["tile_y", "sp", [-1, 1, 1, 2]], ["tile_k", "sp", [-1, 3, 1]]]}, "result": [[0.007226538125], 0, 2.0972633361816406, 1610298460.7033691], "version": 0.2, "tvm_version": "0.8.dev0"}
{"input": ["cuda -keys=cuda,gpu -max_num_threads=1024 -model=t4 -thread_warp_size=32", "dense_large_batch.cuda", [["TENSOR", [128, 768], "float32"], ["TENSOR", [2304, 768], "float32"], null, "float32"], {}], "config": {"index": 396086, "code_hash": null, "entity": [["tile_x", "sp", [-1, 2, 1, 8]], ["tile_y", "sp", [-1, 1, 1, 1]], ["tile_k", "sp", [-1, 3, 1]]]}, "result": [[0.013758739400000001], 0, 1.9230890274047852, 1610298462.033115], "version": 0.2, "tvm_version": "0.8.dev0"}
{"input": ["cuda -keys=cuda,gpu -max_num_threads=1024 -model=t4 -thread_warp_size=32", "dense_large_batch.cuda", [["TENSOR", [128, 768], "float32"], ["TENSOR", [2304, 768], "float32"], null, "float32"], {}], "config": {"index": 792065, "code_hash": null, "entity": [["tile_x", "sp", [-1, 2, 1, 4]], ["tile_y", "sp", [-1, 1, 1, 1]], ["tile_k", "sp", [-1, 6, 1]]]}, "result": [[0.0200985193], 0, 2.2901909351348877, 1610298463.7562492], "version": 0.2, "tvm_version": "0.8.dev0"}
{"input": ["cuda -keys=cuda,gpu -max_num_threads=1024 -model=t4 -thread_warp_size=32", "dense_large_batch.cuda", [["TENSOR", [128, 768], "float32"], ["TENSOR", [2304, 768], "float32"], null, "float32"], {}], "config": {"index": 594037, "code_hash": null, "entity": [["tile_x", "sp", [-1, 2, 1, 2]], ["tile_y", "sp", [-1, 1, 1, 1]], ["tile_k", "sp", [-1, 4, 1]]]}, "result": [[0.0167276424], 0, 2.7869458198547363, 1610298465.869974], "version": 0.2, "tvm_version": "0.8.dev0"}
{"input": ["cuda -keys=cuda,gpu -max_num_threads=1024 -model=t4 -thread_warp_size=32", "dense_large_batch.cuda", [["TENSOR", [128, 768], "float32"], ["TENSOR", [2304, 768], "float32"], null, "float32"], {}], "config": {"index": 626465, "code_hash": null, "entity": [["tile_x", "sp", [-1, 2, 1, 4]], ["tile_y", "sp", [-1, 1, 1, 2]], ["tile_k", "sp", [-1, 4, 1]]]}, "result": [[0.0111550131], 0, 1.8046948909759521, 1610298467.044401], "version": 0.2, "tvm_version": "0.8.dev0"}
{"input": ["cuda -keys=cuda,gpu -max_num_threads=1024 -model=t4 -thread_warp_size=32", "dense_large_batch.cuda", [["TENSOR", [128, 768], "float32"], ["TENSOR", [2304, 768], "float32"], null, "float32"], {}], "config": {"index": 3564086, "code_hash": null, "entity": [["tile_x", "sp", [-1, 2, 1, 8]], ["tile_y", "sp", [-1, 1, 1, 1]], ["tile_k", "sp", [-1, 1, 2]]]}, "result": [[0.013451877849999998], 0, 1.9680113792419434, 1610298468.3513596], "version": 0.2, "tvm_version": "0.8.dev0"}
{"input": ["cuda -keys=cuda,gpu -max_num_threads=1024 -model=t4 -thread_warp_size=32", "dense_large_batch.cuda", [["TENSOR", [128, 768], "float32"], ["TENSOR", [2304, 768], "float32"], null, "float32"], {}], "config": {"index": 792064, "code_hash": null, "entity": [["tile_x", "sp", [-1, 1, 1, 4]], ["tile_y", "sp", [-1, 1, 1, 1]], ["tile_k", "sp", [-1, 6, 1]]]}, "result": [[0.0163913984], 0, 2.714521646499634, 1610298470.5227125], "version": 0.2, "tvm_version": "0.8.dev0"}
{"input": ["cuda -keys=cuda,gpu -max_num_threads=1024 -model=t4 -thread_warp_size=32", "dense_large_batch.cuda", [["TENSOR", [128, 768], "float32"], ["TENSOR", [2304, 768], "float32"], null, "float32"], {}], "config": {"index": 3671725, "code_hash": null, "entity": [["tile_x", "sp", [-1, 1, 1, 8]], ["tile_y", "sp", [-1, 1, 1, 8]], ["tile_k", "sp", [-1, 1, 2]]]}, "result": [[0.0045042050294117645], 0, 1.6435420513153076, 1610298471.5793734], "version": 0.2, "tvm_version": "0.8.dev0"}
{"input": ["cuda -keys=cuda,gpu -max_num_threads=1024 -model=t4 -thread_warp_size=32", "dense_large_batch.cuda", [["TENSOR", [128, 768], "float32"], ["TENSOR", [2304, 768], "float32"], null, "float32"], {}], "config": {"index": 3820385, "code_hash": null, "entity": [["tile_x", "sp", [-1, 2, 1, 4]], ["tile_y", "sp", [-1, 1, 1, 3]], ["tile_k", "sp", [-1, 2, 2]]]}, "result": [[0.0074342269375], 0, 1.9010388851165771, 1610298472.946005], "version": 0.2, "tvm_version": "0.8.dev0"}
{"input": ["cuda -keys=cuda,gpu -max_num_threads=1024 -model=t4 -thread_warp_size=32", "dense_large_batch.cuda", [["TENSOR", [128, 768], "float32"], ["TENSOR", [2304, 768], "float32"], null, "float32"], {}], "config": {"index": 256405, "code_hash": null, "entity": [["tile_x", "sp", [-1, 1, 1, 8]], ["tile_y", "sp", [-1, 1, 1, 3]], ["tile_k", "sp", [-1, 2, 1]]]}, "result": [[0.00803726815], 0, 1.527714729309082, 1610298473.9173498], "version": 0.2, "tvm_version": "0.8.dev0"}
{"input": ["cuda -keys=cuda,gpu -max_num_threads=1024 -model=t4 -thread_warp_size=32", "dense_large_batch.cuda", [["TENSOR", [128, 768], "float32"], ["TENSOR", [2304, 768], "float32"], null, "float32"], {}], "config": {"index": 626464, "code_hash": null, "entity": [["tile_x", "sp", [-1, 1, 1, 4]], ["tile_y", "sp", [-1, 1, 1, 2]], ["tile_k", "sp", [-1, 4, 1]]]}, "result": [[0.0135749048], 0, 1.7044167518615723, 1610298475.2080297], "version": 0.2, "tvm_version": "0.8.dev0"}
{"input": ["cuda -keys=cuda,gpu -max_num_threads=1024 -model=t4 -thread_warp_size=32", "dense_large_batch.cuda", [["TENSOR", [128, 768], "float32"], ["TENSOR", [2304, 768], "float32"], null, "float32"], {}], "config": {"index": 792037, "code_hash": null, "entity": [["tile_x", "sp", [-1, 2, 1, 2]], ["tile_y", "sp", [-1, 1, 1, 1]], ["tile_k", "sp", [-1, 6, 1]]]}, "result": [[0.01637820765], 0, 2.670711040496826, 1610298477.3695428], "version": 0.2, "tvm_version": "0.8.dev0"}
{"input": ["cuda -keys=cuda,gpu -max_num_threads=1024 -model=t4 -thread_warp_size=32", "dense_large_batch.cuda", [["TENSOR", [128, 768], "float32"], ["TENSOR", [2304, 768], "float32"], null, "float32"], {}], "config": {"index": 3658745, "code_hash": null, "entity": [["tile_x", "sp", [-1, 2, 1, 4]], ["tile_y", "sp", [-1, 1, 1, 6]], ["tile_k", "sp", [-1, 1, 2]]]}, "result": [[0.0047860665], 0, 1.7210488319396973, 1610298480.5997274], "version": 0.2, "tvm_version": "0.8.dev0"}
{"input": ["cuda -keys=cuda,gpu -max_num_threads=1024 -model=t4 -thread_warp_size=32", "dense_large_batch.cuda", [["TENSOR", [128, 768], "float32"], ["TENSOR", [2304, 768], "float32"], null, "float32"], {}], "config": {"index": 824465, "code_hash": null, "entity": [["tile_x", "sp", [-1, 2, 1, 4]], ["tile_y", "sp", [-1, 1, 1, 2]], ["tile_k", "sp", [-1, 6, 1]]]}, "result": [[0.01101294235], 0, 1.6387243270874023, 1610298481.7808294], "version": 0.2, "tvm_version": "0.8.dev0"}
{"input": ["cuda -keys=cuda,gpu -max_num_threads=1024 -model=t4 -thread_warp_size=32", "dense_large_batch.cuda", [["TENSOR", [128, 768], "float32"], ["TENSOR", [2304, 768], "float32"], null, "float32"], {}], "config": {"index": 850385, "code_hash": null, "entity": [["tile_x", "sp", [-1, 2, 1, 4]], ["tile_y", "sp", [-1, 1, 1, 3]], ["tile_k", "sp", [-1, 6, 1]]]}, "result": [[0.008385445], 0, 1.5523855686187744, 1610298482.797028], "version": 0.2, "tvm_version": "0.8.dev0"}
{"input": ["cuda -keys=cuda,gpu -max_num_threads=1024 -model=t4 -thread_warp_size=32", "dense_large_batch.cuda", [["TENSOR", [128, 768], "float32"], ["TENSOR", [2304, 768], "float32"], null, "float32"], {}], "config": {"index": 3622386, "code_hash": null, "entity": [["tile_x", "sp", [-1, 4, 1, 4]], ["tile_y", "sp", [-1, 1, 1, 3]], ["tile_k", "sp", [-1, 1, 2]]]}, "result": [[0.00503302215625], 0, 1.5786614418029785, 1610298483.8759527], "version": 0.2, "tvm_version": "0.8.dev0"}
{"input": ["cuda -keys=cuda,gpu -max_num_threads=1024 -model=t4 -thread_warp_size=32", "dense_large_batch.cuda", [["TENSOR", [128, 768], "float32"], ["TENSOR", [2304, 768], "float32"], null, "float32"], {}], "config": {"index": 454406, "code_hash": null, "entity": [["tile_x", "sp", [-1, 2, 1, 8]], ["tile_y", "sp", [-1, 1, 1, 3]], ["tile_k", "sp", [-1, 3, 1]]]}, "result": [[0.00572803575], 0, 1.8169147968292236, 1610298485.0552979], "version": 0.2, "tvm_version": "0.8.dev0"}
{"input": ["cuda -keys=cuda,gpu -max_num_threads=1024 -model=t4 -thread_warp_size=32", "dense_large_batch.cuda", [["TENSOR", [128, 768], "float32"], ["TENSOR", [2304, 768], "float32"], null, "float32"], {}], "config": {"index": 490765, "code_hash": null, "entity": [["tile_x", "sp", [-1, 1, 1, 8]], ["tile_y", "sp", [-1, 1, 1, 6]], ["tile_k", "sp", [-1, 3, 1]]]}, "result": [[0.004082356657894737], 0, 1.640185832977295, 1610298486.1095855], "version": 0.2, "tvm_version": "0.8.dev0"}
{"input": ["cuda -keys=cuda,gpu -max_num_threads=1024 -model=t4 -thread_warp_size=32", "dense_large_batch.cuda", [["TENSOR", [128, 768], "float32"], ["TENSOR", [2304, 768], "float32"], null, "float32"], {}], "config": {"index": 428464, "code_hash": null, "entity": [["tile_x", "sp", [-1, 1, 1, 4]], ["tile_y", "sp", [-1, 1, 1, 2]], ["tile_k", "sp", [-1, 3, 1]]]}, "result": [[0.010268430200000001], 0, 1.761125087738037, 1610298487.2263808], "version": 0.2, "tvm_version": "0.8.dev0"}
{"input": ["cuda -keys=cuda,gpu -max_num_threads=1024 -model=t4 -thread_warp_size=32", "dense_large_batch.cuda", [["TENSOR", [128, 768], "float32"], ["TENSOR", [2304, 768], "float32"], null, "float32"], {}], "config": {"index": 3794465, "code_hash": null, "entity": [["tile_x", "sp", [-1, 2, 1, 4]], ["tile_y", "sp", [-1, 1, 1, 2]], ["tile_k", "sp", [-1, 2, 2]]]}, "result": [[0.01115055865], 0, 1.7547121047973633, 1610298488.327175], "version": 0.2, "tvm_version": "0.8.dev0"}
{"input": ["cuda -keys=cuda,gpu -max_num_threads=1024 -model=t4 -thread_warp_size=32", "dense_large_batch.cuda", [["TENSOR", [128, 768], "float32"], ["TENSOR", [2304, 768], "float32"], null, "float32"], {}], "config": {"index": 3638605, "code_hash": null, "entity": [["tile_x", "sp", [-1, 1, 1, 8]], ["tile_y", "sp", [-1, 1, 1, 4]], ["tile_k", "sp", [-1, 1, 2]]]}, "result": [[0.006760851375], 0, 1.89760160446167, 1610298489.6053734], "version": 0.2, "tvm_version": "0.8.dev0"}
{"input": ["cuda -keys=cuda,gpu -max_num_threads=1024 -model=t4 -thread_warp_size=32", "dense_large_batch.cuda", [["TENSOR", [128, 768], "float32"], ["TENSOR", [2304, 768], "float32"], null, "float32"], {}], "config": {"index": 594039, "code_hash": null, "entity": [["tile_x", "sp", [-1, 8, 1, 2]], ["tile_y", "sp", [-1, 1, 1, 1]], ["tile_k", "sp", [-1, 4, 1]]]}, "result": [[0.01248552115], 0, 1.917475700378418, 1610298490.8598402], "version": 0.2, "tvm_version": "0.8.dev0"}
{"input": ["cuda -keys=cuda,gpu -max_num_threads=1024 -model=t4 -thread_warp_size=32", "dense_large_batch.cuda", [["TENSOR", [128, 768], "float32"], ["TENSOR", [2304, 768], "float32"], null, "float32"], {}], "config": {"index": 3658765, "code_hash": null, "entity": [["tile_x", "sp", [-1, 1, 1, 8]], ["tile_y", "sp", [-1, 1, 1, 6]], ["tile_k", "sp", [-1, 1, 2]]]}, "result": [[0.004625706363636364], 0, 1.652855634689331, 1610298491.9051988], "version": 0.2, "tvm_version": "0.8.dev0"}
{"input": ["cuda -keys=cuda,gpu -max_num_threads=1024 -model=t4 -thread_warp_size=32", "dense_large_batch.cuda", [["TENSOR", [128, 768], "float32"], ["TENSOR", [2304, 768], "float32"], null, "float32"], {}], "config": {"index": 652384, "code_hash": null, "entity": [["tile_x", "sp", [-1, 1, 1, 4]], ["tile_y", "sp", [-1, 1, 1, 3]], ["tile_k", "sp", [-1, 4, 1]]]}, "result": [[0.0090915449], 0, 1.5703158378601074, 1610298492.9460058], "version": 0.2, "tvm_version": "0.8.dev0"}
{"input": ["cuda -keys=cuda,gpu -max_num_threads=1024 -model=t4 -thread_warp_size=32", "dense_large_batch.cuda", [["TENSOR", [128, 768], "float32"], ["TENSOR", [2304, 768], "float32"], null, "float32"], {}], "config": {"index": 3671726, "code_hash": null, "entity": [["tile_x", "sp", [-1, 2, 1, 8]], ["tile_y", "sp", [-1, 1, 1, 8]], ["tile_k", "sp", [-1, 1, 2]]]}, "result": [[0.002561527426229508], 0, 1.6094720363616943, 1610298493.9984992], "version": 0.2, "tvm_version": "0.8.dev0"}
{"input": ["cuda -keys=cuda,gpu -max_num_threads=1024 -model=t4 -thread_warp_size=32", "dense_large_batch.cuda", [["TENSOR", [128, 768], "float32"], ["TENSOR", [2304, 768], "float32"], null, "float32"], {}], "config": {"index": 3794438, "code_hash": null, "entity": [["tile_x", "sp", [-1, 4, 1, 2]], ["tile_y", "sp", [-1, 1, 1, 2]], ["tile_k", "sp", [-1, 2, 2]]]}, "result": [[0.0111530308], 0, 1.7096285820007324, 1610298495.1709273], "version": 0.2, "tvm_version": "0.8.dev0"}
{"input": ["cuda -keys=cuda,gpu -max_num_threads=1024 -model=t4 -thread_warp_size=32", "dense_large_batch.cuda", [["TENSOR", [128, 768], "float32"], ["TENSOR", [2304, 768], "float32"], null, "float32"], {}], "config": {"index": 4158038, "code_hash": null, "entity": [["tile_x", "sp", [-1, 4, 1, 2]], ["tile_y", "sp", [-1, 1, 1, 1]], ["tile_k", "sp", [-1, 4, 2]]]}, "result": [[0.014115550900000001], 0, 1.8690338134765625, 1610298496.5273588], "version": 0.2, "tvm_version": "0.8.dev0"}
{"input": ["cuda -keys=cuda,gpu -max_num_threads=1024 -model=t4 -thread_warp_size=32", "dense_large_batch.cuda", [["TENSOR", [128, 768], "float32"], ["TENSOR", [2304, 768], "float32"], null, "float32"], {}], "config": {"index": 3762065, "code_hash": null, "entity": [["tile_x", "sp", [-1, 2, 1, 4]], ["tile_y", "sp", [-1, 1, 1, 1]], ["tile_k", "sp", [-1, 2, 2]]]}, "result": [[0.0201537179], 0, 2.1522161960601807, 1610298498.254778], "version": 0.2, "tvm_version": "0.8.dev0"}
{"input": ["cuda -keys=cuda,gpu -max_num_threads=1024 -model=t4 -thread_warp_size=32", "dense_large_batch.cuda", [["TENSOR", [128, 768], "float32"], ["TENSOR", [2304, 768], "float32"], null, "float32"], {}], "config": {"index": 4216358, "code_hash": null, "entity": [["tile_x", "sp", [-1, 4, 1, 2]], ["tile_y", "sp", [-1, 1, 1, 3]], ["tile_k", "sp", [-1, 4, 2]]]}, "result": [[0.0056602710625], 0, 1.732130527496338, 1610298501.1435156], "version": 0.2, "tvm_version": "0.8.dev0"}
{"input": ["cuda -keys=cuda,gpu -max_num_threads=1024 -model=t4 -thread_warp_size=32", "dense_large_batch.cuda", [["TENSOR", [128, 768], "float32"], ["TENSOR", [2304, 768], "float32"], null, "float32"], {}], "config": {"index": 3564066, "code_hash": null, "entity": [["tile_x", "sp", [-1, 4, 1, 4]], ["tile_y", "sp", [-1, 1, 1, 1]], ["tile_k", "sp", [-1, 1, 2]]]}, "result": [[0.01344955585], 0, 1.661273717880249, 1610298502.4550216], "version": 0.2, "tvm_version": "0.8.dev0"}
{"input": ["cuda -keys=cuda,gpu -max_num_threads=1024 -model=t4 -thread_warp_size=32", "dense_large_batch.cuda", [["TENSOR", [128, 768], "float32"], ["TENSOR", [2304, 768], "float32"], null, "float32"], {}], "config": {"index": 652385, "code_hash": null, "entity": [["tile_x", "sp", [-1, 2, 1, 4]], ["tile_y", "sp", [-1, 1, 1, 3]], ["tile_k", "sp", [-1, 4, 1]]]}, "result": [[0.00745329], 0, 1.8249211311340332, 1610298503.8231301], "version": 0.2, "tvm_version": "0.8.dev0"}
{"input": ["cuda -keys=cuda,gpu -max_num_threads=1024 -model=t4 -thread_warp_size=32", "dense_large_batch.cuda", [["TENSOR", [128, 768], "float32"], ["TENSOR", [2304, 768], "float32"], null, "float32"], {}], "config": {"index": 3820386, "code_hash": null, "entity": [["tile_x", "sp", [-1, 4, 1, 4]], ["tile_y", "sp", [-1, 1, 1, 3]], ["tile_k", "sp", [-1, 2, 2]]]}, "result": [[0.00508015371875], 0, 1.684570074081421, 1610298504.9249675], "version": 0.2, "tvm_version": "0.8.dev0"}
{"input": ["cuda -keys=cuda,gpu -max_num_threads=1024 -model=t4 -thread_warp_size=32", "dense_large_batch.cuda", [["TENSOR", [128, 768], "float32"], ["TENSOR", [2304, 768], "float32"], null, "float32"], {}], "config": {"index": 990037, "code_hash": null, "entity": [["tile_x", "sp", [-1, 2, 1, 2]], ["tile_y", "sp", [-1, 1, 1, 1]], ["tile_k", "sp", [-1, 8, 1]]]}, "result": [[0.0164007253], 0, 2.6160924434661865, 1610298506.9496462], "version": 0.2, "tvm_version": "0.8.dev0"}
{"input": ["cuda -keys=cuda,gpu -max_num_threads=1024 -model=t4 -thread_warp_size=32", "dense_large_batch.cuda", [["TENSOR", [128, 768], "float32"], ["TENSOR", [2304, 768], "float32"], null, "float32"], {}], "config": {"index": 3762039, "code_hash": null, "entity": [["tile_x", "sp", [-1, 8, 1, 2]], ["tile_y", "sp", [-1, 1, 1, 1]], ["tile_k", "sp", [-1, 2, 2]]]}, "result": [[0.0125298585], 0, 1.9122796058654785, 1610298508.2124746], "version": 0.2, "tvm_version": "0.8.dev0"}
{"input": ["cuda -keys=cuda,gpu -max_num_threads=1024 -model=t4 -thread_warp_size=32", "dense_large_batch.cuda", [["TENSOR", [128, 768], "float32"], ["TENSOR", [2304, 768], "float32"], null, "float32"], {}], "config": {"index": 3856744, "code_hash": null, "entity": [["tile_x", "sp", [-1, 1, 1, 4]], ["tile_y", "sp", [-1, 1, 1, 6]], ["tile_k", "sp", [-1, 2, 2]]]}, "result": [[0.00600239421875], 0, 1.8740930557250977, 1610298509.4102535], "version": 0.2, "tvm_version": "0.8.dev0"}
{"input": ["cuda -keys=cuda,gpu -max_num_threads=1024 -model=t4 -thread_warp_size=32", "dense_large_batch.cuda", [["TENSOR", [128, 768], "float32"], ["TENSOR", [2304, 768], "float32"], null, "float32"], {}], "config": {"index": 3658744, "code_hash": null, "entity": [["tile_x", "sp", [-1, 1, 1, 4]], ["tile_y", "sp", [-1, 1, 1, 6]], ["tile_k", "sp", [-1, 1, 2]]]}, "result": [[0.00614980603125], 0, 1.7837302684783936, 1610298510.610109], "version": 0.2, "tvm_version": "0.8.dev0"}
{"input": ["cuda -keys=cuda,gpu -max_num_threads=1024 -model=t4 -thread_warp_size=32", "dense_large_batch.cuda", [["TENSOR", [128, 768], "float32"], ["TENSOR", [2304, 768], "float32"], null, "float32"], {}], "config": {"index": 3596464, "code_hash": null, "entity": [["tile_x", "sp", [-1, 1, 1, 4]], ["tile_y", "sp", [-1, 1, 1, 2]], ["tile_k", "sp", [-1, 1, 2]]]}, "result": [[0.0140466174], 0, 1.872602939605713, 1610298511.8951962], "version": 0.2, "tvm_version": "0.8.dev0"}
{"input": ["cuda -keys=cuda,gpu -max_num_threads=1024 -model=t4 -thread_warp_size=32", "dense_large_batch.cuda", [["TENSOR", [128, 768], "float32"], ["TENSOR", [2304, 768], "float32"], null, "float32"], {}], "config": {"index": 3794464, "code_hash": null, "entity": [["tile_x", "sp", [-1, 1, 1, 4]], ["tile_y", "sp", [-1, 1, 1, 2]], ["tile_k", "sp", [-1, 2, 2]]]}, "result": [[0.013626034149999999], 0, 1.864563226699829, 1610298513.149467], "version": 0.2, "tvm_version": "0.8.dev0"}
{"input": ["cuda -keys=cuda,gpu -max_num_threads=1024 -model=t4 -thread_warp_size=32", "dense_large_batch.cuda", [["TENSOR", [128, 768], "float32"], ["TENSOR", [2304, 768], "float32"], null, "float32"], {}], "config": {"index": 3622405, "code_hash": null, "entity": [["tile_x", "sp", [-1, 1, 1, 8]], ["tile_y", "sp", [-1, 1, 1, 3]], ["tile_k", "sp", [-1, 1, 2]]]}, "result": [[0.00805771555], 0, 1.4748799800872803, 1610298514.1230366], "version": 0.2, "tvm_version": "0.8.dev0"}
{"input": ["cuda -keys=cuda,gpu -max_num_threads=1024 -model=t4 -thread_warp_size=32", "dense_large_batch.cuda", [["TENSOR", [128, 768], "float32"], ["TENSOR", [2304, 768], "float32"], null, "float32"], {}], "config": {"index": 3992465, "code_hash": null, "entity": [["tile_x", "sp", [-1, 2, 1, 4]], ["tile_y", "sp", [-1, 1, 1, 2]], ["tile_k", "sp", [-1, 3, 2]]]}, "result": [[0.0110658427], 0, 1.6189079284667969, 1610298515.203282], "version": 0.2, "tvm_version": "0.8.dev0"}
{"input": ["cuda -keys=cuda,gpu -max_num_threads=1024 -model=t4 -thread_warp_size=32", "dense_large_batch.cuda", [["TENSOR", [128, 768], "float32"], ["TENSOR", [2304, 768], "float32"], null, "float32"], {}], "config": {"index": 3820384, "code_hash": null, "entity": [["tile_x", "sp", [-1, 1, 1, 4]], ["tile_y", "sp", [-1, 1, 1, 3]], ["tile_k", "sp", [-1, 2, 2]]]}, "result": [[0.00912761265], 0, 1.5015249252319336, 1610298516.188116], "version": 0.2, "tvm_version": "0.8.dev0"}
{"input": ["cuda -keys=cuda,gpu -max_num_threads=1024 -model=t4 -thread_warp_size=32", "dense_large_batch.cuda", [["TENSOR", [128, 768], "float32"], ["TENSOR", [2304, 768], "float32"], null, "float32"], {}], "config": {"index": 3658766, "code_hash": null, "entity": [["tile_x", "sp", [-1, 2, 1, 8]], ["tile_y", "sp", [-1, 1, 1, 6]], ["tile_k", "sp", [-1, 1, 2]]]}, "result": [[0.0030110305294117645], 0, 1.826124906539917, 1610298597.4262717], "version": 0.2, "tvm_version": "0.8.dev0"}
{"input": ["cuda -keys=cuda,gpu -max_num_threads=1024 -model=t4 -thread_warp_size=32", "dense_large_batch.cuda", [["TENSOR", [128, 768], "float32"], ["TENSOR", [2304, 768], "float32"], null, "float32"], {}], "config": {"index": 3692225, "code_hash": null, "entity": [["tile_x", "sp", [-1, 2, 1, 4]], ["tile_y", "sp", [-1, 1, 1, 12]], ["tile_k", "sp", [-1, 1, 2]]]}, "result": [[0.0029494954905660378], 0, 1.4343807697296143, 1610298598.4841492], "version": 0.2, "tvm_version": "0.8.dev0"}
{"input": ["cuda -keys=cuda,gpu -max_num_threads=1024 -model=t4 -thread_warp_size=32", "dense_large_batch.cuda", [["TENSOR", [128, 768], "float32"], ["TENSOR", [2304, 768], "float32"], null, "float32"], {}], "config": {"index": 6839726, "code_hash": null, "entity": [["tile_x", "sp", [-1, 2, 1, 8]], ["tile_y", "sp", [-1, 1, 1, 8]], ["tile_k", "sp", [-1, 1, 3]]]}, "result": [[0.0202068239], 0, 2.310957193374634, 1610298600.2928202], "version": 0.2, "tvm_version": "0.8.dev0"}
{"input": ["cuda -keys=cuda,gpu -max_num_threads=1024 -model=t4 -thread_warp_size=32", "dense_large_batch.cuda", [["TENSOR", [128, 768], "float32"], ["TENSOR", [2304, 768], "float32"], null, "float32"], {}], "config": {"index": 292766, "code_hash": null, "entity": [["tile_x", "sp", [-1, 2, 1, 8]], ["tile_y", "sp", [-1, 1, 1, 6]], ["tile_k", "sp", [-1, 2, 1]]]}, "result": [[0.002928109679245283], 0, 1.5914857387542725, 1610298601.3466215], "version": 0.2, "tvm_version": "0.8.dev0"}
{"input": ["cuda -keys=cuda,gpu -max_num_threads=1024 -model=t4 -thread_warp_size=32", "dense_large_batch.cuda", [["TENSOR", [128, 768], "float32"], ["TENSOR", [2304, 768], "float32"], null, "float32"], {}], "config": {"index": 3671705, "code_hash": null, "entity": [["tile_x", "sp", [-1, 2, 1, 4]], ["tile_y", "sp", [-1, 1, 1, 8]], ["tile_k", "sp", [-1, 1, 2]]]}, "result": [[0.004504281088235294], 0, 1.6971430778503418, 1610298602.413758], "version": 0.2, "tvm_version": "0.8.dev0"}
{"input": ["cuda -keys=cuda,gpu -max_num_threads=1024 -model=t4 -thread_warp_size=32", "dense_large_batch.cuda", [["TENSOR", [128, 768], "float32"], ["TENSOR", [2304, 768], "float32"], null, "float32"], {}], "config": {"index": 272606, "code_hash": null, "entity": [["tile_x", "sp", [-1, 2, 1, 8]], ["tile_y", "sp", [-1, 1, 1, 4]], ["tile_k", "sp", [-1, 2, 1]]]}, "result": [[0.003818280575], 0, 1.6973774433135986, 1610298603.4637103], "version": 0.2, "tvm_version": "0.8.dev0"}
{"input": ["cuda -keys=cuda,gpu -max_num_threads=1024 -model=t4 -thread_warp_size=32", "dense_large_batch.cuda", [["TENSOR", [128, 768], "float32"], ["TENSOR", [2304, 768], "float32"], null, "float32"], {}], "config": {"index": 6826766, "code_hash": null, "entity": [["tile_x", "sp", [-1, 2, 1, 8]], ["tile_y", "sp", [-1, 1, 1, 6]], ["tile_k", "sp", [-1, 1, 3]]]}, "result": [[0.00309603978], 0, 1.7701663970947266, 1610298604.5331097], "version": 0.2, "tvm_version": "0.8.dev0"}
{"input": ["cuda -keys=cuda,gpu -max_num_threads=1024 -model=t4 -thread_warp_size=32", "dense_large_batch.cuda", [["TENSOR", [128, 768], "float32"], ["TENSOR", [2304, 768], "float32"], null, "float32"], {}], "config": {"index": 6854825, "code_hash": null, "entity": [["tile_x", "sp", [-1, 2, 1, 4]], ["tile_y", "sp", [-1, 1, 1, 9]], ["tile_k", "sp", [-1, 1, 3]]]}, "result": [[0.004380228], 0, 1.7916254997253418, 1610298605.6127083], "version": 0.2, "tvm_version": "0.8.dev0"}
{"input": ["cuda -keys=cuda,gpu -max_num_threads=1024 -model=t4 -thread_warp_size=32", "dense_large_batch.cuda", [["TENSOR", [128, 768], "float32"], ["TENSOR", [2304, 768], "float32"], null, "float32"], {}], "config": {"index": 6839705, "code_hash": null, "entity": [["tile_x", "sp", [-1, 2, 1, 4]], ["tile_y", "sp", [-1, 1, 1, 8]], ["tile_k", "sp", [-1, 1, 3]]]}, "result": [[0.0031413319800000002], 0, 1.664499044418335, 1610298606.6790485], "version": 0.2, "tvm_version": "0.8.dev0"}
{"input": ["cuda -keys=cuda,gpu -max_num_threads=1024 -model=t4 -thread_warp_size=32", "dense_large_batch.cuda", [["TENSOR", [128, 768], "float32"], ["TENSOR", [2304, 768], "float32"], null, "float32"], {}], "config": {"index": 3638621, "code_hash": null, "entity": [["tile_x", "sp", [-1, 2, 1, 16]], ["tile_y", "sp", [-1, 1, 1, 4]], ["tile_k", "sp", [-1, 1, 2]]]}, "result": [[0.003606246162790698], 0, 1.7946114540100098, 1610298607.7659392], "version": 0.2, "tvm_version": "0.8.dev0"}
{"input": ["cuda -keys=cuda,gpu -max_num_threads=1024 -model=t4 -thread_warp_size=32", "dense_large_batch.cuda", [["TENSOR", [128, 768], "float32"], ["TENSOR", [2304, 768], "float32"], null, "float32"], {}], "config": {"index": 3702305, "code_hash": null, "entity": [["tile_x", "sp", [-1, 2, 1, 4]], ["tile_y", "sp", [-1, 1, 1, 16]], ["tile_k", "sp", [-1, 1, 2]]]}, "result": [[0.0029956631764705885], 0, 1.7447495460510254, 1610298608.8383968], "version": 0.2, "tvm_version": "0.8.dev0"}
{"input": ["cuda -keys=cuda,gpu -max_num_threads=1024 -model=t4 -thread_warp_size=32", "dense_large_batch.cuda", [["TENSOR", [128, 768], "float32"], ["TENSOR", [2304, 768], "float32"], null, "float32"], {}], "config": {"index": 8621706, "code_hash": null, "entity": [["tile_x", "sp", [-1, 4, 1, 4]], ["tile_y", "sp", [-1, 1, 1, 8]], ["tile_k", "sp", [-1, 1, 4]]]}, "result": [[0.0291793619], 0, 3.0293354988098145, 1610298611.18793], "version": 0.2, "tvm_version": "0.8.dev0"}
{"input": ["cuda -keys=cuda,gpu -max_num_threads=1024 -model=t4 -thread_warp_size=32", "dense_large_batch.cuda", [["TENSOR", [128, 768], "float32"], ["TENSOR", [2304, 768], "float32"], null, "float32"], {}], "config": {"index": 3638607, "code_hash": null, "entity": [["tile_x", "sp", [-1, 4, 1, 8]], ["tile_y", "sp", [-1, 1, 1, 4]], ["tile_k", "sp", [-1, 1, 2]]]}, "result": [[0.003976099564102564], 0, 1.6860909461975098, 1610298612.2936888], "version": 0.2, "tvm_version": "0.8.dev0"}
{"input": ["cuda -keys=cuda,gpu -max_num_threads=1024 -model=t4 -thread_warp_size=32", "dense_large_batch.cuda", [["TENSOR", [128, 768], "float32"], ["TENSOR", [2304, 768], "float32"], null, "float32"], {}], "config": {"index": 326225, "code_hash": null, "entity": [["tile_x", "sp", [-1, 2, 1, 4]], ["tile_y", "sp", [-1, 1, 1, 12]], ["tile_k", "sp", [-1, 2, 1]]]}, "result": [[0.002939938641509434], 0, 1.503429651260376, 1610298613.3563526], "version": 0.2, "tvm_version": "0.8.dev0"}
{"input": ["cuda -keys=cuda,gpu -max_num_threads=1024 -model=t4 -thread_warp_size=32", "dense_large_batch.cuda", [["TENSOR", [128, 768], "float32"], ["TENSOR", [2304, 768], "float32"], null, "float32"], {}], "config": {"index": 6806606, "code_hash": null, "entity": [["tile_x", "sp", [-1, 2, 1, 8]], ["tile_y", "sp", [-1, 1, 1, 4]], ["tile_k", "sp", [-1, 1, 3]]]}, "result": [[0.004013972153846154], 0, 1.5855214595794678, 1610298614.4309008], "version": 0.2, "tvm_version": "0.8.dev0"}
{"input": ["cuda -keys=cuda,gpu -max_num_threads=1024 -model=t4 -thread_warp_size=32", "dense_large_batch.cuda", [["TENSOR", [128, 768], "float32"], ["TENSOR", [2304, 768], "float32"], null, "float32"], {}], "config": {"index": 3692245, "code_hash": null, "entity": [["tile_x", "sp", [-1, 1, 1, 8]], ["tile_y", "sp", [-1, 1, 1, 12]], ["tile_k", "sp", [-1, 1, 2]]]}, "result": [[0.002957337283018868], 0, 1.5032439231872559, 1610298615.4904263], "version": 0.2, "tvm_version": "0.8.dev0"}
{"input": ["cuda -keys=cuda,gpu -max_num_threads=1024 -model=t4 -thread_warp_size=32", "dense_large_batch.cuda", [["TENSOR", [128, 768], "float32"], ["TENSOR", [2304, 768], "float32"], null, "float32"], {}], "config": {"index": 3856766, "code_hash": null, "entity": [["tile_x", "sp", [-1, 2, 1, 8]], ["tile_y", "sp", [-1, 1, 1, 6]], ["tile_k", "sp", [-1, 2, 2]]]}, "result": [[0.003267548705882353], 0, 1.7491331100463867, 1610298618.771021], "version": 0.2, "tvm_version": "0.8.dev0"}
{"input": ["cuda -keys=cuda,gpu -max_num_threads=1024 -model=t4 -thread_warp_size=32", "dense_large_batch.cuda", [["TENSOR", [128, 768], "float32"], ["TENSOR", [2304, 768], "float32"], null, "float32"], {}], "config": {"index": 3869705, "code_hash": null, "entity": [["tile_x", "sp", [-1, 2, 1, 4]], ["tile_y", "sp", [-1, 1, 1, 8]], ["tile_k", "sp", [-1, 2, 2]]]}, "result": [[0.00312602906], 0, 1.4879980087280273, 1610298619.8419082], "version": 0.2, "tvm_version": "0.8.dev0"}
{"input": ["cuda -keys=cuda,gpu -max_num_threads=1024 -model=t4 -thread_warp_size=32", "dense_large_batch.cuda", [["TENSOR", [128, 768], "float32"], ["TENSOR", [2304, 768], "float32"], null, "float32"], {}], "config": {"index": 3856745, "code_hash": null, "entity": [["tile_x", "sp", [-1, 2, 1, 4]], ["tile_y", "sp", [-1, 1, 1, 6]], ["tile_k", "sp", [-1, 2, 2]]]}, "result": [[0.004505942264705883], 0, 1.6101272106170654, 1610298620.921912], "version": 0.2, "tvm_version": "0.8.dev0"}
{"input": ["cuda -keys=cuda,gpu -max_num_threads=1024 -model=t4 -thread_warp_size=32", "dense_large_batch.cuda", [["TENSOR", [128, 768], "float32"], ["TENSOR", [2304, 768], "float32"], null, "float32"], {}], "config": {"index": 3638726, "code_hash": null, "entity": [["tile_x", "sp", [-1, 2, 1, 8]], ["tile_y", "sp", [-1, 2, 1, 4]], ["tile_k", "sp", [-1, 1, 2]]]}, "result": [[0.0025440283387096773], 0, 1.580451488494873, 1610298621.9947755], "version": 0.2, "tvm_version": "0.8.dev0"}
{"input": ["cuda -keys=cuda,gpu -max_num_threads=1024 -model=t4 -thread_warp_size=32", "dense_large_batch.cuda", [["TENSOR", [128, 768], "float32"], ["TENSOR", [2304, 768], "float32"], null, "float32"], {}], "config": {"index": 336305, "code_hash": null, "entity": [["tile_x", "sp", [-1, 2, 1, 4]], ["tile_y", "sp", [-1, 1, 1, 16]], ["tile_k", "sp", [-1, 2, 1]]]}, "result": [[0.0030015859019607845], 0, 1.7566416263580322, 1610298623.065499], "version": 0.2, "tvm_version": "0.8.dev0"}
{"input": ["cuda -keys=cuda,gpu -max_num_threads=1024 -model=t4 -thread_warp_size=32", "dense_large_batch.cuda", [["TENSOR", [128, 768], "float32"], ["TENSOR", [2304, 768], "float32"], null, "float32"], {}], "config": {"index": 8608766, "code_hash": null, "entity": [["tile_x", "sp", [-1, 2, 1, 8]], ["tile_y", "sp", [-1, 1, 1, 6]], ["tile_k", "sp", [-1, 1, 4]]]}, "result": [[0.041459610349999995], 0, 3.7545878887176514, 1610298626.139832], "version": 0.2, "tvm_version": "0.8.dev0"}
{"input": ["cuda -keys=cuda,gpu -max_num_threads=1024 -model=t4 -thread_warp_size=32", "dense_large_batch.cuda", [["TENSOR", [128, 768], "float32"], ["TENSOR", [2304, 768], "float32"], null, "float32"], {}], "config": {"index": 3692246, "code_hash": null, "entity": [["tile_x", "sp", [-1, 2, 1, 8]], ["tile_y", "sp", [-1, 1, 1, 12]], ["tile_k", "sp", [-1, 1, 2]]]}, "result": [[0.00737288596875], 0, 2.2932376861572266, 1610298627.6000164], "version": 0.2, "tvm_version": "0.8.dev0"}
{"input": ["cuda -keys=cuda,gpu -max_num_threads=1024 -model=t4 -thread_warp_size=32", "dense_large_batch.cuda", [["TENSOR", [128, 768], "float32"], ["TENSOR", [2304, 768], "float32"], null, "float32"], {}], "config": {"index": 6839725, "code_hash": null, "entity": [["tile_x", "sp", [-1, 1, 1, 8]], ["tile_y", "sp", [-1, 1, 1, 8]], ["tile_k", "sp", [-1, 1, 3]]]}, "result": [[0.00313962132], 0, 1.8130342960357666, 1610298628.6572332], "version": 0.2, "tvm_version": "0.8.dev0"}
{"input": ["cuda -keys=cuda,gpu -max_num_threads=1024 -model=t4 -thread_warp_size=32", "dense_large_batch.cuda", [["TENSOR", [128, 768], "float32"], ["TENSOR", [2304, 768], "float32"], null, "float32"], {}], "config": {"index": 230501, "code_hash": null, "entity": [["tile_x", "sp", [-1, 2, 1, 16]], ["tile_y", "sp", [-1, 1, 1, 2]], ["tile_k", "sp", [-1, 2, 1]]]}, "result": [[0.00668325071875], 0, 2.0250792503356934, 1610298629.9584656], "version": 0.2, "tvm_version": "0.8.dev0"}
{"input": ["cuda -keys=cuda,gpu -max_num_threads=1024 -model=t4 -thread_warp_size=32", "dense_large_batch.cuda", [["TENSOR", [128, 768], "float32"], ["TENSOR", [2304, 768], "float32"], null, "float32"], {}], "config": {"index": 8621705, "code_hash": null, "entity": [["tile_x", "sp", [-1, 2, 1, 4]], ["tile_y", "sp", [-1, 1, 1, 8]], ["tile_k", "sp", [-1, 1, 4]]]}, "result": [[0.00313397652], 0, 1.627511739730835, 1610298630.938142], "version": 0.2, "tvm_version": "0.8.dev0"}
{"input": ["cuda -keys=cuda,gpu -max_num_threads=1024 -model=t4 -thread_warp_size=32", "dense_large_batch.cuda", [["TENSOR", [128, 768], "float32"], ["TENSOR", [2304, 768], "float32"], null, "float32"], {}], "config": {"index": 256407, "code_hash": null, "entity": [["tile_x", "sp", [-1, 4, 1, 8]], ["tile_y", "sp", [-1, 1, 1, 3]], ["tile_k", "sp", [-1, 2, 1]]]}, "result": [[0.00492092059375], 0, 1.7793099880218506, 1610298632.0269232], "version": 0.2, "tvm_version": "0.8.dev0"}
{"input": ["cuda -keys=cuda,gpu -max_num_threads=1024 -model=t4 -thread_warp_size=32", "dense_large_batch.cuda", [["TENSOR", [128, 768], "float32"], ["TENSOR", [2304, 768], "float32"], null, "float32"], {}], "config": {"index": 6839706, "code_hash": null, "entity": [["tile_x", "sp", [-1, 4, 1, 4]], ["tile_y", "sp", [-1, 1, 1, 8]], ["tile_k", "sp", [-1, 1, 3]]]}, "result": [[0.0028365583636363635], 0, 1.7052979469299316, 1610298633.1157353], "version": 0.2, "tvm_version": "0.8.dev0"}
{"input": ["cuda -keys=cuda,gpu -max_num_threads=1024 -model=t4 -thread_warp_size=32", "dense_large_batch.cuda", [["TENSOR", [128, 768], "float32"], ["TENSOR", [2304, 768], "float32"], null, "float32"], {}], "config": {"index": 8621726, "code_hash": null, "entity": [["tile_x", "sp", [-1, 2, 1, 8]], ["tile_y", "sp", [-1, 1, 1, 8]], ["tile_k", "sp", [-1, 1, 4]]]}, "result": [[0.029106639950000002], 0, 2.930701494216919, 1610298635.4566066], "version": 0.2, "tvm_version": "0.8.dev0"}
{"input": ["cuda -keys=cuda,gpu -max_num_threads=1024 -model=t4 -thread_warp_size=32", "dense_large_batch.cuda", [["TENSOR", [128, 768], "float32"], ["TENSOR", [2304, 768], "float32"], null, "float32"], {}], "config": {"index": 292745, "code_hash": null, "entity": [["tile_x", "sp", [-1, 2, 1, 4]], ["tile_y", "sp", [-1, 1, 1, 6]], ["tile_k", "sp", [-1, 2, 1]]]}, "result": [[0.00461604396969697], 0, 1.595874547958374, 1610298636.51581], "version": 0.2, "tvm_version": "0.8.dev0"}
{"input": ["cuda -keys=cuda,gpu -max_num_threads=1024 -model=t4 -thread_warp_size=32", "dense_large_batch.cuda", [["TENSOR", [128, 768], "float32"], ["TENSOR", [2304, 768], "float32"], null, "float32"], {}], "config": {"index": 3856746, "code_hash": null, "entity": [["tile_x", "sp", [-1, 4, 1, 4]], ["tile_y", "sp", [-1, 1, 1, 6]], ["tile_k", "sp", [-1, 2, 2]]]}, "result": [[0.003238218354166667], 0, 1.7436623573303223, 1610298637.6097877], "version": 0.2, "tvm_version": "0.8.dev0"}
{"input": ["cuda -keys=cuda,gpu -max_num_threads=1024 -model=t4 -thread_warp_size=32", "dense_large_batch.cuda", [["TENSOR", [128, 768], "float32"], ["TENSOR", [2304, 768], "float32"], null, "float32"], {}], "config": {"index": 6826765, "code_hash": null, "entity": [["tile_x", "sp", [-1, 1, 1, 8]], ["tile_y", "sp", [-1, 1, 1, 6]], ["tile_k", "sp", [-1, 1, 3]]]}, "result": [[0.004093652078431372], 0, 1.7933917045593262, 1610298641.2124693], "version": 0.2, "tvm_version": "0.8.dev0"}
{"input": ["cuda -keys=cuda,gpu -max_num_threads=1024 -model=t4 -thread_warp_size=32", "dense_large_batch.cuda", [["TENSOR", [128, 768], "float32"], ["TENSOR", [2304, 768], "float32"], null, "float32"], {}], "config": {"index": 3869706, "code_hash": null, "entity": [["tile_x", "sp", [-1, 4, 1, 4]], ["tile_y", "sp", [-1, 1, 1, 8]], ["tile_k", "sp", [-1, 2, 2]]]}, "result": [[0.0028714733333333334], 0, 1.663160800933838, 1610298642.3309789], "version": 0.2, "tvm_version": "0.8.dev0"}
{"input": ["cuda -keys=cuda,gpu -max_num_threads=1024 -model=t4 -thread_warp_size=32", "dense_large_batch.cuda", [["TENSOR", [128, 768], "float32"], ["TENSOR", [2304, 768], "float32"], null, "float32"], {}], "config": {"index": 256406, "code_hash": null, "entity": [["tile_x", "sp", [-1, 2, 1, 8]], ["tile_y", "sp", [-1, 1, 1, 3]], ["tile_k", "sp", [-1, 2, 1]]]}, "result": [[0.005039956], 0, 1.4723310470581055, 1610298643.431113], "version": 0.2, "tvm_version": "0.8.dev0"}
{"input": ["cuda -keys=cuda,gpu -max_num_threads=1024 -model=t4 -thread_warp_size=32", "dense_large_batch.cuda", [["TENSOR", [128, 768], "float32"], ["TENSOR", [2304, 768], "float32"], null, "float32"], {}], "config": {"index": 305726, "code_hash": null, "entity": [["tile_x", "sp", [-1, 2, 1, 8]], ["tile_y", "sp", [-1, 1, 1, 8]], ["tile_k", "sp", [-1, 2, 1]]]}, "result": [[0.0025653016229508197], 0, 1.7788872718811035, 1610298644.5012195], "version": 0.2, "tvm_version": "0.8.dev0"}
{"input": ["cuda -keys=cuda,gpu -max_num_threads=1024 -model=t4 -thread_warp_size=32", "dense_large_batch.cuda", [["TENSOR", [128, 768], "float32"], ["TENSOR", [2304, 768], "float32"], null, "float32"], {}], "config": {"index": 6860225, "code_hash": null, "entity": [["tile_x", "sp", [-1, 2, 1, 4]], ["tile_y", "sp", [-1, 1, 1, 12]], ["tile_k", "sp", [-1, 1, 3]]]}, "result": [[0.002853823945454545], 0, 1.6347248554229736, 1610298645.576007], "version": 0.2, "tvm_version": "0.8.dev0"}
{"input": ["cuda -keys=cuda,gpu -max_num_threads=1024 -model=t4 -thread_warp_size=32", "dense_large_batch.cuda", [["TENSOR", [128, 768], "float32"], ["TENSOR", [2304, 768], "float32"], null, "float32"], {}], "config": {"index": 305705, "code_hash": null, "entity": [["tile_x", "sp", [-1, 2, 1, 4]], ["tile_y", "sp", [-1, 1, 1, 8]], ["tile_k", "sp", [-1, 2, 1]]]}, "result": [[0.004503262264705883], 0, 1.5920443534851074, 1610298646.6423874], "version": 0.2, "tvm_version": "0.8.dev0"}
{"input": ["cuda -keys=cuda,gpu -max_num_threads=1024 -model=t4 -thread_warp_size=32", "dense_large_batch.cuda", [["TENSOR", [128, 768], "float32"], ["TENSOR", [2304, 768], "float32"], null, "float32"], {}], "config": {"index": 6839704, "code_hash": null, "entity": [["tile_x", "sp", [-1, 1, 1, 4]], ["tile_y", "sp", [-1, 1, 1, 8]], ["tile_k", "sp", [-1, 1, 3]]]}, "result": [[0.004573428848484848], 0, 1.6120390892028809, 1610298647.7048292], "version": 0.2, "tvm_version": "0.8.dev0"}
{"input": ["cuda -keys=cuda,gpu -max_num_threads=1024 -model=t4 -thread_warp_size=32", "dense_large_batch.cuda", [["TENSOR", [128, 768], "float32"], ["TENSOR", [2304, 768], "float32"], null, "float32"], {}], "config": {"index": 6854824, "code_hash": null, "entity": [["tile_x", "sp", [-1, 1, 1, 4]], ["tile_y", "sp", [-1, 1, 1, 9]], ["tile_k", "sp", [-1, 1, 3]]]}, "result": [[0.00724317303125], 0, 1.997995138168335, 1610298649.064369], "version": 0.2, "tvm_version": "0.8.dev0"}
{"input": ["cuda -keys=cuda,gpu -max_num_threads=1024 -model=t4 -thread_warp_size=32", "dense_large_batch.cuda", [["TENSOR", [128, 768], "float32"], ["TENSOR", [2304, 768], "float32"], null, "float32"], {}], "config": {"index": 3671706, "code_hash": null, "entity": [["tile_x", "sp", [-1, 4, 1, 4]], ["tile_y", "sp", [-1, 1, 1, 8]], ["tile_k", "sp", [-1, 1, 2]]]}, "result": [[0.003057896725490196], 0, 1.8348751068115234, 1610298650.136716], "version": 0.2, "tvm_version": "0.8.dev0"}
{"input": ["cuda -keys=cuda,gpu -max_num_threads=1024 -model=t4 -thread_warp_size=32", "dense_large_batch.cuda", [["TENSOR", [128, 768], "float32"], ["TENSOR", [2304, 768], "float32"], null, "float32"], {}], "config": {"index": 8608718, "code_hash": null, "entity": [["tile_x", "sp", [-1, 4, 1, 2]], ["tile_y", "sp", [-1, 1, 1, 6]], ["tile_k", "sp", [-1, 1, 4]]]}, "result": [[0.004516114911764706], 0, 1.747861623764038, 1610298651.2147298], "version": 0.2, "tvm_version": "0.8.dev0"}
{"input": ["cuda -keys=cuda,gpu -max_num_threads=1024 -model=t4 -thread_warp_size=32", "dense_large_batch.cuda", [["TENSOR", [128, 768], "float32"], ["TENSOR", [2304, 768], "float32"], null, "float32"], {}], "config": {"index": 3658885, "code_hash": null, "entity": [["tile_x", "sp", [-1, 1, 1, 8]], ["tile_y", "sp", [-1, 2, 1, 6]], ["tile_k", "sp", [-1, 1, 2]]]}, "result": [[0.0029736540943396225], 0, 1.6700327396392822, 1610298652.2774189], "version": 0.2, "tvm_version": "0.8.dev0"}
{"input": ["cuda -keys=cuda,gpu -max_num_threads=1024 -model=t4 -thread_warp_size=32", "dense_large_batch.cuda", [["TENSOR", [128, 768], "float32"], ["TENSOR", [2304, 768], "float32"], null, "float32"], {}], "config": {"index": 6806607, "code_hash": null, "entity": [["tile_x", "sp", [-1, 4, 1, 8]], ["tile_y", "sp", [-1, 1, 1, 4]], ["tile_k", "sp", [-1, 1, 3]]]}, "result": [[0.050110428799999995], 0, 4.267659425735474, 1610298655.9078925], "version": 0.2, "tvm_version": "0.8.dev0"}
{"input": ["cuda -keys=cuda,gpu -max_num_threads=1024 -model=t4 -thread_warp_size=32", "dense_large_batch.cuda", [["TENSOR", [128, 768], "float32"], ["TENSOR", [2304, 768], "float32"], null, "float32"], {}], "config": {"index": 272621, "code_hash": null, "entity": [["tile_x", "sp", [-1, 2, 1, 16]], ["tile_y", "sp", [-1, 1, 1, 4]], ["tile_k", "sp", [-1, 2, 1]]]}, "result": [[0.003637270651162791], 0, 1.7482068538665771, 1610298656.9994018], "version": 0.2, "tvm_version": "0.8.dev0"}
{"input": ["cuda -keys=cuda,gpu -max_num_threads=1024 -model=t4 -thread_warp_size=32", "dense_large_batch.cuda", [["TENSOR", [128, 768], "float32"], ["TENSOR", [2304, 768], "float32"], null, "float32"], {}], "config": {"index": 3702278, "code_hash": null, "entity": [["tile_x", "sp", [-1, 4, 1, 2]], ["tile_y", "sp", [-1, 1, 1, 16]], ["tile_k", "sp", [-1, 1, 2]]]}, "result": [[0.0031549555208333336], 0, 1.6136195659637451, 1610298658.0666277], "version": 0.2, "tvm_version": "0.8.dev0"}
{"input": ["cuda -keys=cuda,gpu -max_num_threads=1024 -model=t4 -thread_warp_size=32", "dense_large_batch.cuda", [["TENSOR", [128, 768], "float32"], ["TENSOR", [2304, 768], "float32"], null, "float32"], {}], "config": {"index": 8621704, "code_hash": null, "entity": [["tile_x", "sp", [-1, 1, 1, 4]], ["tile_y", "sp", [-1, 1, 1, 8]], ["tile_k", "sp", [-1, 1, 4]]]}, "result": [[0.00667988734375], 0, 1.8120148181915283, 1610298659.361159], "version": 0.2, "tvm_version": "0.8.dev0"}
{"input": ["cuda -keys=cuda,gpu -max_num_threads=1024 -model=t4 -thread_warp_size=32", "dense_large_batch.cuda", [["TENSOR", [128, 768], "float32"], ["TENSOR", [2304, 768], "float32"], null, "float32"], {}], "config": {"index": 503705, "code_hash": null, "entity": [["tile_x", "sp", [-1, 2, 1, 4]], ["tile_y", "sp", [-1, 1, 1, 8]], ["tile_k", "sp", [-1, 3, 1]]]}, "result": [[0.0031130438627450983], 0, 1.6370110511779785, 1610298666.702367], "version": 0.2, "tvm_version": "0.8.dev0"}
